author,date,score,comment
孔*宝,2024-09-16,3,北疆明珠塔做电梯到47楼  也就看看国门以及边防公路 隔着玻璃拍照也不是很清晰 总体意义不大 国门从游客中心走过去路并不多 建议不用做15元的观光车 这景点主要就是拍照打卡的意义
去*户,2024-09-26,5,安排的周师傅很靠谱很耐心，中途去游玩了好几个很小众很美的景点，超赞👍
去*户,2024-10-05,5,庄严，国门必须要看的，三国交界
开*贝,2024-08-19,5,套娃酒店不错，里面还有游乐设施
b*9,2024-08-15,5,很方便 ，很快速，不错不错
b*0,2024-08-15,5,挺靠谱，刷身份证直接能进
没*行,2024-08-14,5,学生票靠谱，刷身份证方便
没*行,2024-08-14,5,挺方便的，还可以，现场售票价格一样
o*3,2024-08-13,5,方便快捷，使用也方便，不错。
o*3,2024-08-13,5,方便快捷，使用也非常方便，很不错。
x*5,2024-07-15,1,不知道是怎么评上五A的
m*0,2024-08-19,4,去满洲里旅游必到的景点，只是票价太贵了。
b*轻,2024-08-05,2,不值这个门票价格，太贵了，没有风景，只是打卡，国门很神圣的地方现在变成了摇钱树
r*9,2021-06-28,5,这一次来到呼伦贝尔大草原了，领略了草原的辽阔、空气的清新、蓝天白云的纯净、如画的风景，穿越了大兴安岭，还住了异域风情的木刻楞子、还体验了到了冷和热这两个字在旅途中的意义。在这里要感谢我们的司机师傅，他很耐心，一路上有说有笑，给我们讲当地民俗，介绍风景，带我们吃有特色的美食，价格实惠，每个地方都帮着我们拿行李，最棒的是司机师傅是一位好摄影师，给我们照的照片很好，特别是抓拍跳的，一绝！
v*8,2021-05-22,4,门票定价应在30元以下，里面应开免税店，让游人来看国门及购物。
t*0,2021-07-25,2,小火车二十块开进去就几百米，超级不值，看攻略八十一张门票，现在要买带观景塔的通票，感觉这是最坑的一个景点
i*5,2021-06-28,5,我们这次经历了一个非常愉快的旅程，美丽的呼伦贝尔草原给我们留下了近乎完美的印象，司机兼导游，非常热情的服务，更为我们的旅程增添了许多色彩，感谢旅行社的精心安排，感谢司机的辛勤伴谢谢
y*2,2021-05-05,5,导游超赞，耐心，细心，热心。亲们可来了找他，这家旅游公司特棒服务很好，非常满意，非常推荐，总体超赞，体验很棒，性价比高
恋*雪,2021-04-28,5,呼伦贝尔7日旅游攻略这是我的旅游经验01【关于出行方式】飞机： 海拉尔 东山机场，海拉尔是呼伦贝尔的政府所在地。费用稍微贵一点火车:可以选择聪哈尔滨 转火车，是最近最实惠的。不过旺季的时候一票难求。我当时找的向导帮的忙客车： 呼伦贝尔 主要的旗市区都有长途客车，不过这种方式少有人选02【关于旅游路线】呼伦贝尔 草原主要有两条旅游路线，一条是北线，这也是游 呼伦贝尔 的一条经典路线，它汇集了多种风景元素，可以观看多种地貌地形，有一望无际的大草原，有九曲十八弯的河流，还有萧萧瑟瑟的白桦林，除了美丽的自然风光，还可以体验原始的 俄罗斯 部落。当然北线又细分为小环线、大环线以及超大环线，端看个人时间、精力以及财力了，选择合适的就好。而南线相对来说景色就比较单一以及稀少了，主要是草原以及湖泊，除此之外最大的看点就是 阿尔山 国家森林公园，不过南线是以人文风情取胜，二者各有千秋。如果时间充足，可以南北线都走一遍。当时推荐的这两条线，我果断选择的北线03【关于出行时间】 呼伦贝尔 草原，最美的时候应该是夏天，6月中旬到9月中旬为最佳观赏草原时期。04【关于出行天数】来 呼伦贝尔 草原旅游，至少要有5天以上的时间，因为 呼伦贝尔 太大了，景点之间相隔太远，况且天数太少有一半时间耗费在路途上，得不偿失，推荐5-7天的旅游天数。车型：SUV越野车。行程：D1海拉尔-金帐汗草原蒙古部落-天下第一曲水莫日格勒河-根河湿地-额尔古纳 D2：额尔古纳-白桦林-哈乌尔河-界江游船-室韦-临江D3：临江晨雾-莫尔道嘎国家森林公园-龙岩山-莫尔道嘎 D4：莫尔道嘎-敖鲁古雅鄂温克驯鹿原始部落-住根河 D5：根河-黑山头马场骑马、射箭、穿民族服装拍照-住黑山头边境草原蒙古包 D6：黑山头草原游玩-最美边防公路-186彩带河-满洲里，住满洲里。 D7：满洲里-婚礼宫-猛犸象公园-国门-套娃广场-呼伦湖-海拉尔05【关于旅游当时】呼伦贝尔 草原自驾游，真的很潇洒，当时我们一起包了个车，小张师傅按照我们提前做的攻略。规划好了路线。帮我们定了住房。师傅一边开车，跟我们介绍当地的风土人情，我们相处的非常融洽，还可以随时叫停。草原很大，手机好多时没有信号。在车顶上要多备些水。06【关于旅行装备】1 草原的日头超大，紫外线那叫一个强烈，防晒措施一定要做好。太阳帽、太阳镜、防晒霜、晒后修复露缺一不可。2 保湿是第二要务。保湿面膜、保湿乳液、润唇膏统统背上。3 早晚比较凉，需要一件厚外套或者冲锋衣。依此准备2到3套衣服即可。鞋子选择舒适、跟脚的，一般的户外鞋就够了，无需特意置办行头。4 防蚊措施做好，草原蚊子很厉害，防蚊液必不可少。大家再有什么不明白的，可以找我们当时找的那个向导咨询一下，他对那边还是比较熟悉的，我们只是玩了几天，你推荐给大家，有问题可以问他1512****816
f*3,2021-07-13,4,国门 票价128元庄严肃穆神圣的地方却夹杂着过浓的商业气息！而且票价属实有点不合理！ 小汽车票价20元 体验后觉得票价偏高，车费感觉受骗了其实就没几步路就到了！
f*3,2021-03-25,5,风景很漂亮，疫情期间人也不多，非常值得来！！我们一行3人，包的5座车，大爱，司机和师傅非常有耐心，很负责任，帮我们拿行李
k*3,2021-03-14,5,定了一辆房车，感觉能省房费，不过建议大家还是中间住晚酒店吧，我们玩了5天，车上洗澡不太方便，感觉身上都馊了
a*6,2021-03-14,5,玩法实验室的服务，感觉还是不错，转发朋友圈有个50元的优惠，本来我们错过了，客服晓晨可热心的帮我们重新申请了，感觉非常好
小*2,2021-03-14,5,因为只有5个人，补了200元的差价升级，虽然有点小不开心，但是一辆GL8 玩的很开心，同行的小伙伴很nicce
韶*漾,2021-08-01,5,服务比较好，游玩比较方便。
s*1,2021-07-08,1,千万别去，根本不值30块钱，走挺老远还得爬6楼，啥服务都没有。上去啥也看不到，就能看到铁路线。
m*2,2021-05-17,5,棒棒哒，行程安排合理，很愉快，中午饭很好吃，推荐推荐
u*1,2021-05-09,5,价格很实惠，旅行社服务很贴心，出发前一晚有专人电话确认地址和接送事宜
h*6,2021-04-27,5,学习到很多东西，全天也不感觉到累，对于一个吃货来说，中午的午餐特别好，疫情期间分餐制
z*4,2021-04-26,5,纯玩团，玩的很开心，不错的一次游玩。
w*9,2018-08-22,5,国门景区是必去的，没有风景如画，没有传说神话，她就是我们祖国边陲的神圣象征，庄严肃穆，不可侵犯。这边是满洲里的繁华（当然也是因了旅游带热），那边是俄罗斯小镇的宁静。四代国门的微缩景观，让我们见证了国门变迁。还有我们的哨岗和俄罗斯的哨岗～
1*6,2021-03-24,5,服务很好，体验很棒，非常满意，！总体超赞
含*瑰,2021-03-24,5,非常满意，性价比高，体验很棒，服务很好
f*0,2021-03-24,5,很充实的这些天 ，美景多多 ，回头再和亲友来一趟。包车的大哥很周到，辛苦了
m*7,2021-03-14,5,现在这个时间段去的，人比较少，行程很自由
u*n,2021-03-14,5,草还没绿……但是孩子在衡水上学，只能这个时候出来玩了。
k*5,2021-03-14,5,靠谱团，没有乱收费，性价比很高。天气也不错
n*S,2019-07-12,5,国门距满洲里市区9公里，交通便利，乘10路公交车即可到达，国家5A级旅游景区，包括41号界碑等，一直是爱国主义教育基地。7月1日全国首家以“国门党建”命名的党员干部教育培训学院——满洲里国门党建学院在景区内揭牌运营。目前是第五代国门——恢弘大气，可以上去登高远眺对面的俄罗斯后贝加尔斯克。
z*8,2019-06-26,5,上海一家四口。6月18号到达海拉尔机场。提前在网上。做了攻略，联系上了一个当地的人。去机场接机。当天晚上住在那海拉尔全季酒店。非常的卫生。也非常干净。我入住的时候价格358元。双人标准间。含双早。第二天，海拉尔出发金帐汗。在京张汉看了。蒙古人的表演。接下来金帐汗往里穿越草原。穿越木尔格勒河。大概有90多公里的路程，全程草原里穿越。我们在断崖拍了视频和照片。《寻龙诀》的取景地。大概是中午1: 30的样子，到达了额尔古纳。住在了古纳国际酒店。在酒店的旁边。有一个金皇冠饭店。做的口味非常好。吃完饭休息了一会儿。下午四点出发，额尔古纳亚洲第一大湿地。这次是当地人带我们，从小路走的。没有花门票。门票价格在75元左右。第二天早晨。吃完早餐。我二姑那出发。室韦口岸。沿途去了白桦林。里面有各种动物。最可爱的就是麋鹿。门票50元。接下来到了。奥鲁古雅。在国家森林公园游玩了近两小时。我们驱车到达了室韦口岸。体验了俄罗斯民族镇的生活。当天晚上入住了室韦口岸。第三天由室韦口岸到黑山头。沿途从中俄边境线。出发。一条界河。两边的草原非常的美丽。可以看到俄罗斯的村庄。羊群牛群。下午两点到达了黑山头。入住了蒙古包。草原迎宾部落。简单了，吃点东西。跟店家要了一个烤全羊。大概要考四小时。我们去。草原骑马。草原卡丁车。结束后回了蒙古包，休息了一下。全羊烤好了。当地蒙古人。给我们载歌载舞。一个全羊仪式。第四天黑山头出发满洲里。我们去了186彩带和，玩了滑草。100元一张门票。去了当地牧户家，体验了牧户的生活。每人150。吃喝玩都包括在内。可以挤羊奶。射箭。草原蹦蹦车。荡秋千。品尝奶茶。喂小羊。土拨鼠。接下来去了。猛犸象园。门票30元。接下来到了满州里。我们住的套娃酒店。房费860。吃完饭看了俄罗斯大马戏。第五天。早晨吃完早餐。去了满洲里国门。游玩了近一小时。接下来出发。呼伦湖。品尝了当地特色湖鱼🐠一路草原回到了海拉尔。到海拉尔的时间大概下午一点多。吃完午饭。送我们去了机场。总都说来这次旅行非常的不错。当地导游服务耐心。景色不错。我们全程包车。是那种SUV的越野车。方便坐着舒服。可以穿越草原。有想来草原玩儿的可以咨询他。推荐给大家V×  ☞  zh零七零三一六一九人不错，很实在。注意的是，早晚凉。带长裤。防晒服。花露水。防晒霜。这里紫外线比较强。
w*9,2018-08-22,5,国门景区是必去的，没有风景如画，没有传说神话，她就是我们祖国边陲的神圣象征，庄严肃穆，不可侵犯。这边是满洲里的繁华（当然也是因了旅游带热），那边是俄罗斯小镇的宁静。四代国门的微缩景观，让我们见证了国门变迁。还有我们的哨岗和俄罗斯的哨岗～
小*货,2019-06-05,5,来到满洲里，最不能错过的就是套娃，这座小城的美丽，出乎我的想象，可以说这是俄罗斯版的迪士尼。建筑都是俄罗斯风格，这里也有很多俄罗斯人过来游玩，真心不错！满洲里套娃景区是满洲里市的标志性旅游景点。球幕飞翔影院飞跃满洲里、呼伦贝尔大草原、大兴安岭俄罗斯人风情演出和俄罗斯大马戏！
z*8,2019-06-26,0,上海一家四口。6月18号到达海拉尔机场。提前在网上。做了攻略，联系上了一个当地的人。去机场接机。当天晚上住在那海拉尔全季酒店。非常的卫生。也非常干净。我入住的时候价格358元。双人标准间。含双早。第二天，海拉尔出发金帐汗。在京张汉看了。蒙古人的表演。接下来金帐汗往里穿越草原。穿越木尔格勒河。大概有90多公里的路程，全程草原里穿越。我们在断崖拍了视频和照片。《寻龙诀》的取景地。大概是中午1: 30的样子，到达了额尔古纳。住在了古纳国际酒店。在酒店的旁边。有一个金皇冠饭店。做的口味非常好。吃完饭休息了一会儿。下午四点出发，额尔古纳亚洲第一大湿地。这次是当地人带我们，从小路走的。没有花门票。门票价格在75元左右。第二天早晨。吃完早餐。我二姑那出发。室韦口岸。沿途去了白桦林。里面有各种动物。最可爱的就是麋鹿。门票50元。接下来到了。奥鲁古雅。在国家森林公园游玩了近两小时。我们驱车到达了室韦口岸。体验了俄罗斯民族镇的生活。当天晚上入住了室韦口岸。第三天由室韦口岸到黑山头。沿途从中俄边境线。出发。一条界河。两边的草原非常的美丽。可以看到俄罗斯的村庄。羊群牛群。下午两点到达了黑山头。入住了蒙古包。草原迎宾部落。简单了，吃点东西。跟店家要了一个烤全羊。大概要考四小时。我们去。草原骑马。草原卡丁车。结束后回了蒙古包，休息了一下。全羊烤好了。当地蒙古人。给我们载歌载舞。一个全羊仪式。第四天黑山头出发满洲里。我们去了186彩带和，玩了滑草。100元一张门票。去了当地牧户家，体验了牧户的生活。每人150。吃喝玩都包括在内。可以挤羊奶。射箭。草原蹦蹦车。荡秋千。品尝奶茶。喂小羊。土拨鼠。接下来去了。猛犸象园。门票30元。接下来到了满州里。我们住的套娃酒店。房费860。吃完饭看了俄罗斯大马戏。第五天。早晨吃完早餐。去了满洲里国门。游玩了近一小时。接下来出发。呼伦湖。品尝了当地特色湖鱼🐠一路草原回到了海拉尔。到海拉尔的时间大概下午一点多。吃完午饭。送我们去了机场。总都说来这次旅行非常的不错。当地导游服务耐心。景色不错。我们全程包车。是那种SUV的越野车。方便坐着舒服。可以穿越草原。有想来草原玩儿的可以咨询他。推荐给大家V×  ☞  zh零七零三一六一九人不错，很实在。注意的是，早晚凉。带长裤。防晒服。花露水。防晒霜。这里紫外线比较强。
黑*游,2019-03-26,5,想来呼伦贝尔好几年了，2018年6月28日，来了一场说走就走的旅行，我和爸妈媳妇来到了海拉尔起止行程，到这来的接待是是之前来过的朋友推荐的，人挺好，行程从来不延误，宋导没的说151-2466-1539-你们也可以找他，六天五晚行程没人3680元/人，衣食住行车等一应俱全。从海拉尔开始，进草原，金帐汗，制高点，末日格勒河，断崖，寻龙诀拍摄地，湿地，额尔古纳，恩和，临江，室韦，俄罗斯纪念乡，一卡，二卡，五卡，七卡，驯鹿园，白桦林，满洲里  ，套娃广场，国门，呼伦湖，大马戏。好多好多地方。很好玩，这一句下来拍了好多照片，吃了好多草原特色，烤全羊，鲜肉，缓解了好多工作压力，看了看无边无际得草原，心胸宽广的想法浮现在脑海，爸妈玩的也很开心，在满洲里中苏街，买了四串蜜蜡，一人一串，买了些牛肉干，奶片寄回家里给亲戚朋友，一路跟司机有说有笑，很幽默，蒙古人很豪爽，伟大的国门让我心里汹涌澎湃。激动不已，酒量那是杠杠的，比我们哈尔滨人厉害多了。不说太多了  ，想到草原的想来玩的，当地人宋导没毛病。好。。。
z*8,2019-03-23,5,上海一家四口出行，呼伦贝尔。来之前做了翻天覆地的攻略。这次我看到了草原，空气是那么清新、天空是那么明朗，大草原在白云的映衬下，更加绚丽，真是风吹草低见牛羊的景象，草丛的那些牛啊羊啊为辽阔草原增添了一道道美丽的风景线。大草原的天空是那么迷人，那一片一片的云就像在眼前，好像一伸手就能够撕下一片来，但却是那么遥远，云的形状也仪态万千，又过了一会，所有的云又无声无息的消失了，这时候的天空是瓦蓝瓦蓝的，没有一丝杂质。放眼望去没有尽头，此刻我贪婪的大口呼吸着新鲜的空气，感觉及其舒服，一路上美景不断，走走停停，拍拍照，草地上打打滚，心情就是个舒畅。阳光下与清澈辽远的蓝天以及芳草如茵的草甸不可阻挡的扑面而来，那一瞬间，整个世界变得安静起来，仿佛只剩下这满目自然的仓绿，这次出行满载而归带着笑容。也非常感谢我的司机师傅。如果大家有想去玩的可以咨询他一下。151-2466-5816人非常不错，开车非常的稳。一路上给你讲故事，逗你开心。笑的我们都肚子疼。哈哈/::>
小*货,2019-06-05,5,来到满洲里，最不能错过的就是套娃，这座小城的美丽，出乎我的想象，可以说这是俄罗斯版的迪士尼。建筑都是俄罗斯风格，这里也有很多俄罗斯人过来游玩，真心不错！
1*9,2019-03-26,0,想来呼伦贝尔好几年了，2018年6月28日，来了一场说走就走的旅行，我和爸妈媳妇来到了海拉尔起止行程，到这来的接待是是之前来过的朋友推荐的，人挺好，行程从来不延误，宋导没的说151-2466-1539-你们也可以找他，六天五晚行程没人3680元/人，衣食住行车等一应俱全。从海拉尔开始，进草原，金帐汗，制高点，末日格勒河，断崖，寻龙诀拍摄地，湿地，额尔古纳，恩和，临江，室韦，俄罗斯纪念乡，一卡，二卡，五卡，七卡，驯鹿园，白桦林，满洲里  ，套娃广场，国门，呼伦湖，大马戏。好多好多地方。很好玩，这一句下来拍了好多照片，吃了好多草原特色，烤全羊，鲜肉，缓解了好多工作压力，看了看无边无际得草原，心胸宽广的想法浮现在脑海，爸妈玩的也很开心，在满洲里中苏街，买了四串蜜蜡，一人一串，买了些牛肉干，奶片寄回家里给亲戚朋友，一路跟司机有说有笑，很幽默，蒙古人很豪爽，伟大的国门让我心里汹涌澎湃。激动不已，酒量那是杠杠的，比我们哈尔滨人厉害多了。不说太多了  ，想到草原的想来玩的，当地人宋导没毛病。好。。。
z*8,2019-03-23,0,上海一家四口出行，呼伦贝尔。来之前做了翻天覆地的攻略。这次我看到了草原，空气是那么清新、天空是那么明朗，大草原在白云的映衬下，更加绚丽，真是风吹草低见牛羊的景象，草丛的那些牛啊羊啊为辽阔草原增添了一道道美丽的风景线。大草原的天空是那么迷人，那一片一片的云就像在眼前，好像一伸手就能够撕下一片来，但却是那么遥远，云的形状也仪态万千，又过了一会，所有的云又无声无息的消失了，这时候的天空是瓦蓝瓦蓝的，没有一丝杂质。放眼望去没有尽头，此刻我贪婪的大口呼吸着新鲜的空气，感觉及其舒服，一路上美景不断，走走停停，拍拍照，草地上打打滚，心情就是个舒畅。阳光下与清澈辽远的蓝天以及芳草如茵的草甸不可阻挡的扑面而来，那一瞬间，整个世界变得安静起来，仿佛只剩下这满目自然的仓绿，这次出行满载而归带着笑容。也非常感谢我的司机师傅。如果大家有想去玩的可以咨询他一下。151-2466-5816人非常不错，开车非常的稳。一路上给你讲故事，逗你开心。笑的我们都肚子疼。哈哈/::>
1*途,2019-04-12,5,刚刚步入草原，我就深深爱上了这美丽的大草原，这里空气清新，没有城市的喧器和汽笛声。放眼望去，绿色的草原，膘肥体壮的牛羊，小马在地上吃草，牧人挥舞着鞭子，唱着悠扬的蒙古长调，听着听着，使我进入了美妙的遐想中然而对于我们生活在钢筋水泥的人们看到这番景象能不尖叫吗穿越60公里的无人区，夏天的草原绿草如茵，深呼吸一口，清香的草木味扑鼻而来，让人心旷神怡、如痴如醉。牛、马和羊漫游在草原上，风吹草动，形成了一幅如诗如画的景象地势平坦而辽阔草原，在远方有微微起伏，整个大地都被草覆盖着，像铺了一层厚厚的地毯，在蓝天的映衬下，我们的片子也显得格外清新。温馨提示：美眉们去除了防晒隔离要做好以外，几块颜色亮丽的披肩是很有必要的，可以防晒可以搭配衣服效果，还有晚上温差大还可以保暖，真是必备神器哦在草原河边架起烧烤炉子，我们中午的午餐就是烤羊肉串，节目就是放风筝，是不是很体闲很放松呀草原上放风筝是呼是件很简单的事，只见风筝摇摇晃晃，就像喝醉了就一样，它一会儿高，一会儿低，像是在翩翩起舞。之后越飞越高，像一只自由自在的小鸟，这样的场景组成了一幅美丽的图画虽然阳光明媚但是草原上微风吹拂一点都不热完全没有出汗的感觉，非常舒服，温馨提示：夏天去草原还是要带驱蚊的
e*0,2019-04-05,5,七月的夏天。来到呼伦贝尔。刚刚步入草原。我就深深爱上了这美丽的大草原，这里空气清新，没有城市的喧闹和汽笛声。放眼望去，绿色的草原，膘肥体壮的牛羊，小马在地上吃草，牧人挥舞着鞭子，唱着悠扬的蒙古长调，听着听着，使我进入了美妙的遐想中……然而对于我们生活在钢筋水泥的人们看到这番景象能不尖叫吗穿越60公里的无人区，夏天的草原绿草如茵，深呼吸一口，清香的草木味扑鼻而来，让人心旷神怡、如痴如醉。牛、马和羊漫游在草原上，风吹草动，形成了一副如诗如画的景象！地势平坦而辽阔草原，在远方有微微起伏，整个大地都被草覆盖着，像铺了一层厚厚的地毯，在蓝天的映衬下，我们的片子也显得格外清新。这次旅行非常满意。非常感谢我的张师傅带我的七日之旅。开车非常稳，我推荐给大家，有需要的可以联系咨询。151-2466-5816/下一次带同事朋友一起过来玩儿，非常值得推荐的景点。
M*7,2019-07-10,5,没啥可评价的   就是来旅游   国门挺好  比俄罗斯的要气派很多  套娃广场可以转转  进去玩我觉得没啥意思  如果时间充足的话可以试试   
1*7,2019-07-03,4,去满洲里当然应该去看看国门了。现在的国门非常高大，是一栋大楼。41号界碑也在这个区域内。里面还有六大会址和前几代的国门。就是商业气氛太浓厚了。
1*途,2019-04-12,0,刚刚步入草原，我就深深爱上了这美丽的大草原，这里空气清新，没有城市的喧器和汽笛声。放眼望去，绿色的草原，膘肥体壮的牛羊，小马在地上吃草，牧人挥舞着鞭子，唱着悠扬的蒙古长调，听着听着，使我进入了美妙的遐想中然而对于我们生活在钢筋水泥的人们看到这番景象能不尖叫吗穿越60公里的无人区，夏天的草原绿草如茵，深呼吸一口，清香的草木味扑鼻而来，让人心旷神怡、如痴如醉。牛、马和羊漫游在草原上，风吹草动，形成了一幅如诗如画的景象地势平坦而辽阔草原，在远方有微微起伏，整个大地都被草覆盖着，像铺了一层厚厚的地毯，在蓝天的映衬下，我们的片子也显得格外清新。温馨提示：美眉们去除了防晒隔离要做好以外，几块颜色亮丽的披肩是很有必要的，可以防晒可以搭配衣服效果，还有晚上温差大还可以保暖，真是必备神器哦在草原河边架起烧烤炉子，我们中午的午餐就是烤羊肉串，节目就是放风筝，是不是很体闲很放松呀草原上放风筝是呼是件很简单的事，只见风筝摇摇晃晃，就像喝醉了就一样，它一会儿高，一会儿低，像是在翩翩起舞。之后越飞越高，像一只自由自在的小鸟，这样的场景组成了一幅美丽的图画虽然阳光明媚但是草原上微风吹拂一点都不热完全没有出汗的感觉，非常舒服，温馨提示：夏天去草原还是要带驱蚊的
p*2,2019-08-18,4,门票是真的贵，感觉也就值30块钱，听说以前卖80，现在便宜点70元啦，这一根冰棍30元🌝超级坑的景区。云南瑞丽的国门都不要钱 免费看的
