author,date,score,comment
e*0,2019-04-05,0,七月的夏天。来到呼伦贝尔。刚刚步入草原。我就深深爱上了这美丽的大草原，这里空气清新，没有城市的喧闹和汽笛声。放眼望去，绿色的草原，膘肥体壮的牛羊，小马在地上吃草，牧人挥舞着鞭子，唱着悠扬的蒙古长调，听着听着，使我进入了美妙的遐想中……然而对于我们生活在钢筋水泥的人们看到这番景象能不尖叫吗穿越60公里的无人区，夏天的草原绿草如茵，深呼吸一口，清香的草木味扑鼻而来，让人心旷神怡、如痴如醉。牛、马和羊漫游在草原上，风吹草动，形成了一副如诗如画的景象！地势平坦而辽阔草原，在远方有微微起伏，整个大地都被草覆盖着，像铺了一层厚厚的地毯，在蓝天的映衬下，我们的片子也显得格外清新。这次旅行非常满意。非常感谢我的张师傅带我的七日之旅。开车非常稳，我推荐给大家，有需要的可以联系咨询。151-2466-5816/下一次带同事朋友一起过来玩儿，非常值得推荐的景点。
S*桐,2018-10-17,5,金秋九月，北疆行——满洲里国门景区（三十），“满洲里国门景区”，国家AAAAA级旅游景区，位于满洲里西部中俄边境处我方一处的乳白色建筑，国门景区包括41号界碑、国门、红色国际秘密交通线遗址、和平之门主题雕塑和满洲里历史浮雕、红色旅游展厅、火车头广场等，国门庄严肃穆，鲜红的国徽和“中华人民共和国”七个红色大字与蓝天辉映，与我国国门相对的，是俄罗斯国家国门，主体建筑由白、蓝、红三种颜色组成，登上国门观景台，眺望与满洲里接壤的俄罗斯城市——后贝加尔斯克市……，满洲里市内有公交车直达国门，车票1元，国门景区门票80元，有些小贵，
没*0,2018-07-15,5,国门景区景区票价感觉有些高，电瓶车是单另收费的而且有些坑，往返20，但是大门离国门挺近的，往返10块还差不多。再就是国门上面卖东西的太多，感觉不好。套娃景区还是挺有特色的，但是感觉票不合理，看不看大马戏都那个价，游乐场好多项目都没来，6D电影提前一两个个小时就得排队。其实买套娃酒店的套票比较划算，一千多带门票带套娃酒店的住宿，就是网上没有看到，去景区门口拿票的时候才知道还有带酒店的套票，没有住套娃酒店好遗憾
驴*行,2019-07-13,4,满洲里城区坐6路与10路公交车总站到国门这，其实这就是一个景区的国门，进出境不是在这边的。就是纯属给游客拍照的地方...
_*9,2019-05-23,5,额尔古纳湿地是中国目前保持原状态最完好、面积较大的湿地，也被誉为“亚洲第一湿地”。[1]额尔古纳湿地位于大兴安岭西北侧，额尔古纳河的东岸，总面积为156.31万公顷，属于额尔古纳河及其支流（根河、得尔布干河、哈乌尔河）的滩涂地。
b*田,2018-07-06,5,国门景区虽然票价有点高，但是很值得一看，进去可以看41号界碑，登上高层看窗外的俄罗斯村庄，离的特别近，看的很清楚，也会培养爱国情结。
x*9,2019-05-23,0,额尔古纳湿地是中国目前保持原状态最完好、面积较大的湿地，也被誉为“亚洲第一湿地”。[1]额尔古纳湿地位于大兴安岭西北侧，额尔古纳河的东岸，总面积为156.31万公顷，属于额尔古纳河及其支流（根河、得尔布干河、哈乌尔河）的滩涂地。
S*3,2019-07-03,0,去满洲里当然应该去看看国门了。现在的国门非常高大，是一栋大楼。41号界碑也在这个区域内。里面还有六大会址和前几代的国门。就是商业气氛太浓厚了。
雪*E,2019-09-27,0,国门景区简直坑死了…门票70…小火车往返15…其实就600m的路…进去就一个国门和路碑…然后上国门观景台还不让坐电梯…自己走上6层…去过的景区里这是最坑的没有之一！这景区唯一能进的理由就是来都来了…大老远来一趟…
大*杜,2018-08-07,5,九天穿越呼伦贝尔的第四天，来到了神圣的满洲里国门景区，我是从网上买的套娃景区和国门景区联票所以十分方便，满洲里国门，位于满市西部中俄边境处我方一侧的乳白色建筑。国门总长105米，高43.7米，宽46.6米，2008年建成。国门庄严肃穆，在国门乳白色的门体上方嵌着“中华人民共和国”七个鲜红大字，上面悬挂的国徽闪着的金光，国际铁路在下面通过。国门景区占地面积13平方公里，包括41号界碑、国门、红色国际秘密交通线遗址、和平之门主体雕塑和满洲里历史浮雕、红色旅游展厅、火车头广场等景点。因为我家老二最爱火车，这里成了孩子特别喜欢的地方。        到达中俄边境中方一侧乳白色的国门后，先排队乘坐电梯到国门观光层，俄境内的车站、建筑、街道、行人尽收眼底，而中方一侧的41号界碑广场、火车头广场等景点，以及专门从事边贸的商业设施也一览无余。然后，走到边境线上的41号界碑广场，与界碑合影的同时，也能看到穿过中俄边境线驶来的隆隆列车。         最后，说说满洲里的红色记忆，经过百年风雨洗礼和十年开放磨砺，满洲里市已经成为一个蜚声中外的口岸名城。上个世纪的二、三十年代，满洲里是我党与共产国际的红色通道；四十年代，苏联红军从这里打响了欧洲战场支援太平洋战场的第一枪；解放战争和抗美援朝战争时期，满洲里口岸曾把大批苏联军援物资运往前线；建国初期，面对帝国主义的海上封锁，满洲里作为共和国的主要外贸通道，有力地支持了中国的经济建设。1992年满洲里被国务院批准为首批沿边开放城市后，满洲里经济和社会各项事业实现了历史性跨越。边境贸易持续健康发展，与俄罗斯、波兰、匈牙利、日本、新加坡等40多个国家和地区建立了广泛的贸易关系；形成了贸易、金融、运输、仓储等综合发展的对外贸易和经济技术合作体系；构建起了易货贸易、现汇贸易、旅游贸易、转口贸易并存的对外贸易格局。满洲里正以崭新的形象屹立于祖国北疆。
许*星,2019-04-06,5,满洲里国门，位于满市西部中俄边境处我方一侧的乳白色建筑。国门总长105米，高43.7米，宽46.6米，2008年建成。国门庄严肃穆，在国门乳白色的门体上方嵌着“中华人民共和国”七个鲜红大字，上面悬挂的国徽闪着的金光，国际铁路在下面通过。现在的满洲里国门是第五代国门 国门景区占地面积13平方公里，包括41号界碑、国门、红色国际秘密交通线遗址、和平之门主体雕塑和满洲里历史浮雕、红色旅游展厅、火车头广场等景点、另外给大家推荐一下我们这次旅行的向导在图中可以找到他
雪*E,2019-09-27,1,国门景区简直坑死了…门票70…小火车往返15…其实就600m的路…进去就一个国门和路碑…然后上国门观景台还不让坐电梯…自己走上6层…去过的景区里这是最坑的没有之一！这景区唯一能进的理由就是来都来了…大老远来一趟…
桃*妖,2019-10-10,5,满洲里是一座美丽的边境城市，风景秀丽，夜景更是迷人。离套娃广场不远的地方就是国门景区，里边有国门历史变革的展示，还有一到五代国门变迁的实物展示，最新的国门二楼是一个观光展示厅，里边既可以看展览，也可以一览两国边境风光，挺好的。国门下面是一列火车道，运气好的话，可以赶上过火车，拍出来的照片会更有感觉。进了景区以后要走一段路，如果不想走路的话，也可以乘坐十五块钱的电瓶车。整体上不错，不过把国门围起来收八十块钱的做法是不是有点儿欠妥当啊。
M*8,2019-05-05,5,没有进去参观，我们是11点左右到的，正好有一辆从俄罗斯开来的火车运送木材，好多好多各种各样的木材。景区门口卖的俄罗斯柿子，马奶柿子，皮球柿子，还有个叫啥忘记了～黄色的最好吃～景区门口有不少卖小商品的，砍价后很便宜，都是中国制造的
迷*羊,2018-08-23,5,来满洲里其实就是为了来国门，边境线呀～基本上国门就是满洲里尽头了，离套娃广场不远，离城区也不远。。毕竟满洲里没多大。中苏街公交过来的。国门门票不便宜，七十还是八十，网上买便宜了几块钱。41号界碑打卡。主要就是看界碑和岗哨小哥哥[奸笑][奸笑]中间那个楼里是满洲里的一些展览，上二层就行了，还以为三层视野更好呢，结果就是楼道里的特产店。。满洲里除了过于商业化外，其他还是挺好的。。。
h*1,2018-07-12,3,在网上买就要保留好票据信息，因为至少检票2次。我觉得满洲里国门景点比较坑的地方在于，好几十一个人，就是蜂拥而至的爬楼梯。好几层楼高。到上面也看不到什么景色。而且国门本来挺庄严的，居然每个楼层都有卖旅游纪念品的。相对满洲里红色展览馆倒是环境很好，知识很丰富。个人觉得票价与景点不太匹配。
兴*淼,2019-07-07,5,满洲里必去的景区，看看国门，看看界碑，风景很好，七月初去的认不是很多，天气很好，交通方便，停车方便。
因*2,2019-08-19,5,还不错，方便！！！就是没有儿童票
z*9,2018-08-16,5,还是推荐的，认为出来旅游，不要以值不值去评价一个景区，你想得到什么，当花钱长见识，国门是中国的一个门面，感受国家的强大，我觉得还是很值得的
w*6,2019-07-07,0,满洲里必去的景区，看看国门，看看界碑，风景很好，七月初去的认不是很多，天气很好，交通方便，停车方便。
p*2,2019-08-18,0,门票是真的贵，感觉也就值30块钱，听说以前卖80，现在便宜点70元啦，这一根冰棍30元🌝超级坑的景区。云南瑞丽的国门都不要钱 免费看的
p*7,2019-07-03,0,满洲里是中俄边境的贸易之城，这里的国门景区是最大的景点了，我们的国门相当的大还可以登上去对面的国门相比之下气势就差多了。
m*3,2019-07-03,0,来满洲里一定要到国门景区来玩一圈，本来只是准备去大草原的，但是人家都说满洲里这个地方特别棒就特地来这里玩了，国门景区真的很经典好大好漂亮！
b*8,2019-07-02,0,满洲里这里的国门景区很大啊，国门也很气派比对面俄罗斯的大多了，这里的人也很多还有很多外国人也来这里参观很值得来这里一次。
开*柿,2019-05-25,5,景区不大，但是来参观意义非常重大，可以看见从新中国开始五个国门的形状，了解国门的历史，还可以看到对面俄罗斯的国门，很有教育
陈*迪,2019-02-13,5,满洲里这个城市满满的外族风情，五颜六色的建筑就像唱着歌跳着舞的喀秋莎一样热情奔放。而在国门边境上，没有想到我们距离俄罗斯就这么近，近到可以看到对面街上的行人（然而并没有人），和塔楼上的俄罗斯士兵。据说以前，还有人对着这边唱歌跳舞，现在嘛可能游客太多了人家不好意思哈哈哈哈。虽然人们被边境线拦着，可火车是畅通无阻的。看着火车轰隆隆从对面开过来，又开过去，感觉还真是挺奇妙的
L*嘟,2019-07-08,5,个人觉得国门不应该收门票。为祖国的强大自豪！
M*8,2019-05-18,5,服务很棒，订的家庭套房淡季还帮免费升级豪华套房。早上还有免费提拉米苏，最主要入住后套娃广场免费进。大宝的评价就是好棒
卢*魂,2019-07-03,5,满洲里是中国的边境，这里的国门景区人非常的多，国门非常的壮观啊，真的是好大好大，满洲里真的是一个很不错的城市，边境贸易很多东西也很多。
申*e,2019-07-03,5,满洲里是中俄边境的贸易之城，这里的国门景区是最大的景点了，我们的国门相当的大还可以登上去对面的国门相比之下气势就差多了。
可*鸭,2019-07-03,5,来满洲里一定要到国门景区来玩一圈，本来只是准备去大草原的，但是人家都说满洲里这个地方特别棒就特地来这里玩了，国门景区真的很经典好大好漂亮！
S*魂,2019-07-02,5,满洲里这里的国门景区很大啊，国门也很气派比对面俄罗斯的大多了，这里的人也很多还有很多外国人也来这里参观很值得来这里一次。
T*s,2018-09-04,5,天蓝草绿，风吹云淡风轻云淡的地方，酒店设施齐全，环境优雅，景色迷人，服务周到，卫生一流，价格小贵，不过因为是假期，所以难免小贵一点，但是也是能够接受的范围。所以还是值得拥有。开车出行最重要的是有车位，别无他求，一切尽在不言中。带着全家来一次深度游，全程往返八千多公里，一路平安，一路风尘，一路美景。因为自驾稍有些累，但是看到全家人玩的开心，所以一定要住的称心。别不多说，既然出门旅游，就要吃好，喝好，睡好，才能玩好！！！！
徐*团,2018-04-01,5,国门景区真的不错，高大雄伟的国门，让人不由得会心生自豪感，望着哨兵、界碑、俄罗斯的国门，看着穿两侧国门而过的中俄列车，真切地感到自己在边境线上啦。既然叫景区当然并不仅仅是国门，有较大的一片区域，还有之前几代国门的模型，以及其他一些景点展区。站在国门的二楼，可以俯瞰下面两国交界的一片区域。国门景区确实值得参观，但门票也真的算贵。我们觉得应该定位于爱国主义教育基地的景区，80元的门票确实贵啊（这是2014的票价）。
玖*童,2018-10-10,5,很值得一去的。中苏边境北国第一门，既感受爱过主义教育，又可以游玩购物。可以做观光车，也可以不做，做就做单程，从出口出来就是免税购物去。参观顺序，界碑，上楼，跨过铁路在另一边下楼，继续拍照，参观。。。
_*0,2019-07-06,3,爬辣么高的楼居然不让坐电梯  让老人和孩子坐坐也行吗   好像是成了那些小商贩的专利   门票也有点小贵   最坑的是景区外的停车场  外地私家车一定要小心了  即使有停车位也要小心被贴罚单  
茂*节,2019-06-01,4,国门非常气派，就是门票有点高了，作为爱国教育基地，象征性收点门票比较好。
M*8,2019-05-31,4,。呼伦贝尔满洲里国门景区南北长约1800米，东西约720米，占地约130万平方米，最北边至中蒙边境线。景区以国门、界碑为核心，以“边关文化”和爱国主义教育为主题，以二连城市历史变迁发展为主线，全力打造一个国内独具边境文化特色，并集旅游观光、军旅体验、爱国主义教育为一体的综合性景区。景区分为入迎宾区、沿途引景区、火车纪念广场区、国门参观区、警犬训练区和界碑参观区几部分。
M*3,2019-05-29,5,看着火车隆隆在中俄两国边境之间穿梭，感觉到这就是国门，就是边境，那边就是异国他乡，41号界碑矗立此处，更加明确地告诉我那边就是俄罗斯。看看以前的四代国门，再看看现在巍然耸立的国门，愈发感觉祖国的强大。在中共六大纪念馆和会谈会晤纪念馆了解到过去辉煌的历史。当地的哥说门票太贵不值得，我觉得不虚此行！
M*0,2019-05-24,5,之前去过三次了，每次去的的时候都有不一样变化，了解更多国门的知识，现在这个国门是第五代了好像，最早的是一个木头和搭成的，这些都在博物馆也看到的，非常好，出行也方便，而且满洲里还有一个套娃广场，非常好玩的地方
1*9,2019-07-10,4,算是个红色旅游景点吧，挺好的看看祖国的强大。但是千万不要听里面的人忽悠坐里面游览小车，还让包车说里面景点离的远。结果里面真不大，走不远都能到。坑
M*1,2019-07-09,5,值得一去的地方，我国强大，没有对比就没有伤害。
d*3,2019-10-05,5,取票太方便了！自助购票也方便！售票大厅排长队 这里基本等两三人就能买上！而且网上购票实惠很多
许*星,2019-04-23,5,满洲里国门：位于满市西部中俄边境处我方一侧的乳白色建筑。国门总长105米，高43.7米，宽46.6米，2008年建成。是第五代国门。国门景区占地面积13平方公里，包括41号界碑、国门、红色国际秘密交通线遗址、和平之门主体雕塑和满洲里历史浮雕、红色旅游展厅、火车头广场等景点。登上国门，俄境后贝加尔斯克区的车站、建筑、街道、行人尽收眼底。
亮*灏,2019-02-19,5,满洲里国门景区真的体现了国家这些年的繁荣昌盛，与邻居老毛子相比在基础建设和经济相比差距明显。当然国门景区还是购物的好地方，虽然价格不是很优惠，但种类齐全。唯一遗憾的是没有去俄罗斯看看。
千*骑,2019-07-13,5,总体来说还是不错，接受了一次爱国主义教育，但是景区的工作人员对业务不算太熟悉，比如41号界碑旁边还有一个40号的红白相间石碑没有人能说清楚！
l*n,2019-07-12,5,还是值得去一趟的。乘乘小火车，看看边界。关键是周围有太多免税店了，几乎都是俄罗斯进口的。看到很多游客专门过来买俄罗斯紫龙晶，还有紫金。
E*2,2019-07-11,4,好。。。。。。。。。。。。。。。。。。。。。。。。。。。。。。。。。。。。。。。。。。。。。。。。。。。
心*g,2018-11-09,4,满洲里口岸是与我国与俄罗斯陆路接壤的边境口岸 ，也是满洲里地区推荐的旅游景点。口岸设施建设简单有特色，不时可以看到俄罗斯方面的火车经过。
c*h,2019-05-22,5,国门还是去很值得去看看的，祖国的边境之一。爬上国门可以看到中俄两国的边境风光，国门里面也有很多特色纪念品的店，可以购物哦。
p*8,2019-08-23,5,普票方便，景区观景舒适，环境还可以
M*4,2018-07-26,5,值得一去！红色教育，带孩子去很有意义！
M*4,2019-06-29,5,国门很壮观   里面卖东西的很讨厌   千万别在里面买东西  宰人
j*6,2018-08-14,5,可以上楼，爬楼梯没电梯
逍*在,2019-03-20,5,中国的北大门，，高43.7米，宽46.6米，2008年建成。国门庄严肃穆，在国门乳白色的门体上方嵌着“中华人民共和国”七个鲜红大字，上面悬挂的国徽闪着的金光，国际铁路在下面通过。现在的满洲里国门是第五代国门 国门景区占地面积13平方公里，包括41号界碑、国门、红色国际秘密交通线遗址、和平之门主体雕塑和满洲里历史浮雕、红色旅游展厅、火车头广场等景点。国门景区还有中俄贸易免税购物商场，里边俄罗斯食品很多，推荐大头娃娃巧克力，很正宗的很好吃
s*4,2019-05-31,0,景点不错，国门很雄伟壮阔，就是去的时候有点冷
c*0,2019-07-11,0,打卡地，景区充斥着各类商店，逛点较少，性价比一般，停车倒不贵，一律5元不限时
C*_,2019-08-09,5,很方便 有自动取票机可以直接取走
独*1,2019-01-25,5,满洲里口岸“国门”，中俄两国国门友好相邻。从威严雄壮的中国国门下方的铁道口，就可穿视到俄罗斯的国门～
i*0,2019-07-09,0,值得一去的地方，我国强大，没有对比就没有伤害。
因*2,2019-08-19,0,还不错，方便！！！就是没有儿童票
i*0,2019-08-03,5,国门，看着很雄伟壮观，但是仔细想想好像不合适作为景点呢
i*0,2019-08-03,5,国门，看着很雄伟壮观，但是仔细想想好像不合适作为景点呢
6*6,2019-06-28,3,说实话，国门景区没什么景色好看的，更多的是爱国情怀的感受。对面破破烂烂，我们这头蒸蒸日上的反差，更能激励我们努力干！
z*g,2018-10-06,5,我爱你中国！亲爱的母亲！
雄*鹰,2019-05-11,3,说实话不值得买票进入游览。检查很严格，景区很小，30分钟就可以游完。
轻*步,2018-06-28,4,边境城市满洲里的标志性景点，这里是中俄边境，有很多跨境贸易，俄罗斯手工艺等商店很多，旅游购物的地方！还有个标志性的国门建筑！
M*6,2019-05-31,5,景点不错，国门很雄伟壮阔，就是去的时候有点冷
t*5,2019-07-18,5,挺方便的 再打点折就好了
阳*媚,2018-08-10,5,满洲里国门位于满市西部中俄边境区，国门总长105米，高43.7米，宽46.6米，2008年建成。国门庄严肃穆，在乳白色的门体上方嵌着“中华人民共和国”七个鲜红的大字，上面悬挂的国徽闪耀着金光，国际铁路在下面通过。国门景区占地面积13平方公里，包括41号界牌、国门、红色国际秘密交通线遗址、和平之门主体雕塑和满洲里浮雕、红色旅游展厅、火车头广场等景点。
1*8,2019-07-13,5,国门的宏伟、壮观，感到祖国的伟大。
h*n,2018-09-24,4,感觉贵了，只是个纪念意义的地方
行*下,2019-07-11,4,打卡地，景区充斥着各类商店，逛点较少，性价比一般，停车倒不贵，一律5元不限时
M*4,2019-07-06,5,电子票，方便，快捷，省时，省力。拿手机直接入门，里面的展厅出示手机订票信息就行。
唯*宝,2018-09-14,5,非常方便，不用取票，门口停车场5元随便停。进国门景区必须带身份证！！！那个啥免税购物区就没必要去了，东西也不便宜
小*圳,2019-07-01,4,不适合我的景点，完全是为了来而来
z*0,2019-07-13,0,国门的宏伟、壮观，感到祖国的伟大。
1*2,2019-05-30,3,有的景点名气很大，去了不逛会遗憾，逛了也没什么感觉，这就是介绍下历史而已，全当走过路过吧，不值票价！
只*花,2018-09-09,5,好！（此评论虽然才1个字，但语法严谨，用词工整，结构巧妙，琅琅上口，可谓言简意赅，足见评论人扎实的文字功底，以及信手拈来的写作技巧和惨绝人寰的创造能力，令人佩服佩服，再加上以感叹号收尾，实在是点睛之笔）
幻*9,2019-05-09,5,满洲里景区是我去过的第二个国门景区。每次在国门我都有一种油然而生的自豪感！满洲里国门景区不大，走路也用不了多长时间。去满洲里旅游必去的景区。
g*0,2019-07-11,0,景区不错，广场树太少，阳光直晒！打折后61元门票，也就来一次！太商业化了！
h*0,2019-07-11,3,景区不错，广场树太少，阳光直晒！打折后61元门票，也就来一次！太商业化了！
r*6,2018-11-19,5,取票方便快捷，很好的一次旅游体验
r*6,2018-11-19,5,景点不错，值得一游，取票方便
S*8,2018-10-25,5,今天天气不太好，已经是淡季了，到这儿的人也没几个，拍照没人抢镜头，这就是最大的动力了！从南来到北，一路感受不同的风景。
M*9,2019-07-08,3,不去后悔去了更后悔的地方，没什么意思
p*4,2019-07-07,0,虽然感觉小贵，不过毕竟是国门，必须进去看看，照相打卡，和界碑合影，哈哈
冷*儿,2018-10-14,5,耗资八千万的国门自然气派！景区里还有博物馆
_*7,2019-05-14,3,我去的时候10月份，没什么好看的。对面俄罗斯界啥都看不着。不过第一次注视国门，看界碑，挺有意义的。嗯！
_*6,2019-04-23,5,景区很大，景色优美，空气清新，趣味性强。适合男女老少游玩，我们去的时候是8月份中旬，天气凉爽，不冷不热，个人认为是最好的季节。
阿*星,2018-08-19,4,到满洲里一定要去国门看看，虽然国内边城不少，但把边境做成5A级景点的，独此一份吧，这里的国门建设的高端大气上档次，和对方的国门形成鲜明对比，几代国门的变迁，就是一部中俄关系史，很有意思，就是旺季人多，排队要排很久。
l*0,2019-04-17,4,远观界对岸的俄罗斯，仅此一个看点。人超多，若高的楼，没有电梯。腿脚不好的人上去比较困难。门票价格偏高。
凉*叔,2018-08-15,5,售票处有自动取票机，取票很方便。比现场买便宜了2块钱，还不错，对面就是俄罗斯国门，现在国门也是第五代国门了，既然到了满洲里，国门还是值得一逛的，旁边还有互贸区，很棒了。
当*儿,2018-06-25,4,满洲里国门景区是满洲里标志性的风景区，景色宜人，值得推荐给大家，趣味性强，性价比超高的，是不错的地方，不错哦！建筑有特色。
浅*丁,2018-08-10,4,其实还是挺有参观意义的，就是觉得80元门票有点小贵。一门分开两国，可以看到往来两国的货运火车，穿梭于此，俄罗斯近在眼前。可以登上二楼平台俯瞰两国风光，游客比较多，需要排队进入。登楼中有所谓的免税店。41号界碑的地方，人太多了，所以没拍。
M*3,2019-07-14,5,国门景点人很多，免税店里商品也不便宜
孟*里,2018-08-07,5,还可以，毕竟是国门，感受中俄边境风情和繁荣的贸易！
行*上,2019-07-13,5,好！！！！！！！！！！！！！！！
M*0,2019-07-13,5,好好好，中国的强大，骄傲自豪，好
z*4,2019-07-13,4,值得去看看。就是有点单一。。。
