author,date,score,comment
_*1,2017-08-06,4,进国门景区，看了几代国门，从国门看到了国家的发展和壮大。感觉看国门，看的是种情怀，如果完全追求景色跟娱乐性的话，可以不用进去。票价确实有点高。在那能看到一辆辆载货火车通行，可见满洲里承载了中俄贸易的很大比例。
M*7,2018-08-30,5,值得一看，自豪感倍增，满洲里必去景点
1*5,2018-07-12,5,国之门，代表中华人民共和国领土主权。
小*敏,2018-08-29,5,非常有自豪感。           
x*7,2018-08-26,4,景区不大，经常在电视上看到国门的风采，中俄对比一下，差距很明显的！建议带小孩来看一下。顺便说一下满洲里的夜景，亮化工程做的比较好，刚觉装饰灯的密度超过了上海外滩！
c*a,2018-10-13,5,很好，下次还会去，不错
5*3,2018-08-22,5,边境还是值得一去的，一景看三国，蒙古，苏联，中国
M*6,2018-08-21,5,我们当天下午4:30才到的目的地，询问后说一个小时左右就可以参观完，之后迅速买票，赶在国门相关人员下班之前登上国门，眺望对方，视线开阔。就是玻璃太花了照相效果不好。
M*9,2018-08-20,5,网上订票非常方便，景点玩的很好，还购了纪念品，以后还会来的。
梦*7,2018-08-20,5,是见过的比较有规模的国门，门票价格小贵。里面还有两个纪念馆，感觉带上初中的小孩来比较好，有个五层楼均是个人卖俄罗斯商品的，商业气氛比较浓。
y*9,2018-11-25,5,有优惠 很方便 值得去的地方！
M*6,2018-08-18,5,满洲里市区有公交直达，比较方便。去的时候蓝天白云天气很好，景区有几个小的博物馆，介绍中共六大中苏秘密交通线等，国门可以登到楼上，俯瞰一下对面俄罗斯的风景
四*上,2018-08-18,4,没去时想着已经来了就要进去看看，终究是国门，进去时才知也不过如此哈，但那天天气很好，蓝天白云下的国门有大国风范。
M*6,2018-11-22,5,边境的风光无限美好，国门景区值得一看。
游*子,2018-08-15,5,唯一的缺点就是网上没有半价票，现场卖票关门太早，国家的国防教育红色历史纪念意义的地方还收那么高的门票
_*5,2018-06-27,5,满洲里国门，让我体会到了祖国（中国）的强大与富饶！
1*8,2018-08-13,4,来了满洲里一定要去的一个景区，看看边境挺好的
M*4,2018-08-13,4,历经2500公里，终于来到满州里国门景区。景区没我想象中的庄严神圣，相对于78元的票价，性价比不高。从门口坐小火车进去，20元往返，因为赶时间就坐了，安检是挺严格的。景点没有讲解，只好自己做好功课。
1*4,2017-07-19,5,满洲里是一座拥有百年历史的口岸城市，素有“东亚之窗”的美誉。满洲里国门，位于满市西部中俄边境处中方一侧的乳白色建筑。国门庄严肃穆，在国门乳白色的门体上方嵌着“中华人民共和国”七个鲜红大字，上面悬挂的国徽闪着的金光，国际铁路在下面通过。
y*4,2018-12-07,0,一般一般一般一般一般一般一般一般一般一般一般
M*3,2018-08-31,3,国门景区不能叫景区。纪念意义大于风景美义，就是一个门和界碑，另加一个六大博物馆，其他都是购物商场。80门票性价比不高，50以内合适。
_*4,2018-08-07,4,值得一看，门票稍微贵些，能深入体会到国家和领土的意义。可能还是唯一的一个中共六大的纪念基地，系统地讲述了我党经历过的一段历史
3*5,2018-11-11,5,很不错，比普通窗口还要快，推荐一下！
1*0,2018-08-04,5,还可以吧，就是到这里来了，必须得看一下国门什么样
M*8,2017-10-16,4,值得去了解一下，知道我们的国境线向我方推动了17公里，失掉了大片的国土，景点本身没有什么趣味，是一个了解历史的地方。门口的火车头广场，火车头上贴着禁止攀爬的字样，正看到一群操广东口音的大妈在往火车头上攀爬，就照了下来。
2*8,2018-11-09,5,暑假带娃来领略国门，人非常多呀
l*艇,2018-08-02,5,不错 不错 不错 不错 不错 不错 不错 不错
小*儿,2018-08-01,4,景点总体就是感受到国家的强大。景点里面卖东西的也好多，而且价格很贵
吴*彬,2018-11-06,5,不去感觉遗憾，但门票有点贵，里面没啥东西
M*0,2018-11-06,5,边境风彩，异国他乡的感觉，不错的体验
M*0,2018-11-06,5,环境优美，值得大家一去，体验异国风情
t*t,2018-11-03,5,很好！！！！！！爱国！！！！！！
1*7,2017-11-26,5,根本没有什么看头儿，对不起这个票价，而且买观光车票推荐买往返票。进去一看，入口和出口不是一个地方。观光车是原路返回，出来后回程票送别的游客了，免得他们也上当！
花*了,2018-10-29,5,透过国门遥望俄罗斯，风很大很冷，站岗的小哥哥辛苦了
b*8,2018-10-09,1,便宜几块钱，但比较麻烦，里面验票太麻烦，不推荐
E*1,2017-10-07,3,这个五星景点有点儿坑，真的就是道门儿，啥风景没有，算是历史地理意义上的吧。
a*g,2018-08-09,3,本来以为这是一个严肃庄重，可以体会到民族自豪感的地方，但是现在商业气息太浓厚了，令人非常失望！希望能改变这种状况，恢复国门原本应有的庄严感。
n*1,2018-10-06,1,不去后悔，去了也后悔！
q*n,2017-10-06,0,总体感觉：1、商业氛围太浓厚。进正门，左边的飞机，登上去一看，机舱里是一个商店。国门主楼，每一层楼梯转角处，都是门对门两间商店，景区出口也都是商店；2、八十元的门票，说实话太贵了。总之，太重的商业氛围和太贵的票价，和国门景区的爱国主义主题不太相称。之前去的室韦口岸，除了边界桥和界碑，就是两家小商店，门票二十元，不知道收的理由是什么。
1*8,2017-10-06,3,总体感觉：1、商业氛围太浓厚。进正门，左边的飞机，登上去一看，机舱里是一个商店。国门主楼，每一层楼梯转角处，都是门对门两间商店，景区出口也都是商店；2、八十元的门票，说实话太贵了。总之，太重的商业氛围和太贵的票价，和国门景区的爱国主义主题不太相称。之前去的室韦口岸，除了边界桥和界碑，就是两家小商店，门票二十元，不知道收的理由是什么。
_*2,2018-10-25,4,主要是体验下国门的庄严吧其他并没啥可看的
3*0,2017-01-30,4,第五代国门景区为国家5A级旅游景区，坐落于满洲里市区以西8公里处中俄两国铁路连接点中方一侧，建筑非常壮观，环境非常优美。与原苏联国门相对应，对比也是很明显哦。满洲里第五代国门是中国陆路口岸最大的国门，此处历经几代国门历史悠久，曾经是红色国际秘密交通线，目前是红色交通线教育基地。
小*蛋,2018-07-18,5,好   可以说非常好     
倾*M,2018-09-04,5,个人感觉还是不错。10年前经常来满洲里 没旅行过。这次一家三口自驾来。
亮*灏,2018-09-03,4,这个套娃广场实话说也就那样，最值得倒是马戏表演。这个地方小的可怜。
夜*风,2018-09-02,5,五星为了国门........人进自己的国门这个费用也太高了吧……
王*3,2018-07-15,5,总体来说还是值得一去的，毕竟到了满洲里，中国较大的内陆口岸，里面的商贩太多，国门内的电梯不对外开放这些是硬伤。
r*1,2018-10-20,5,比现场便宜，二维码进场方便多了。
陆*师,2018-10-19,5,挺不错的！满洲里必游景点儿！！
E*6,2018-10-18,4,真的是不来后悔，来了也后悔的地方
M*3,2018-08-01,3,团很多，人很多，就看下国门，大太阳晒着，大妈们拍照很起劲，标禁止攀爬，四个大妈爬上去大太阳底下拍照半小时，我们走了，她们还在原地拍照
1*7,2018-10-16,5,在这里购票还是很方便的，不用排队
M*6,2018-07-10,5,好评给我的国！不过真的不该收门票费，还有就是最扯淡的小火车每人20元，感觉瞬间就到了，明显是晃点老百姓的！千万别买
A*g,2018-10-15,4,讲道理没什么好看的 比较无聊…
M*3,2018-10-14,5,感觉不错，看到了祖国的强大实力
s*8,2018-07-07,5,还可以吧，到满州里都要到此一游吧，有个国门和界杯
_*8,2018-10-12,5,风景不错，门票也确实比现实便宜
l*6,2018-10-12,5,非常方便，比售票处便宜，值得网购
1*2,2018-10-11,5,不错，挺震撼的，更加有一种爱国感油然而生。
b*a,2018-09-21,1,坑，就冲国门两字去。70门票，景点不够商店来凑。上国门二楼到出口一路商店
s*n,2018-08-22,5,既然到了满洲里，国门还是要看看的。
y*4,2018-08-21,5,取票方便  国门还是可以去游玩一下
_*0,2017-07-27,5,红色旅游教育基地！！值得一去，看看祖国的边疆！！！
_*5,2018-07-22,3,挺不错的，就是门票略贵。商业化，适合打卡式旅游。比套娃广场合适
1*3,2018-06-30,4,国门是神圣的地方，是个象征性景点，没有什么实际内容，居然每人收80元的门票，实在太坑人。给人的感觉太差了。
l*8,2018-08-16,5,主要看看那界碑，其他没啥看的，没什么意思
M*3,2018-08-15,5,庄严，威武，神圣，不可越界，国门
l*4,2017-06-17,0,这个国门跟难进，要留下80元的“买路钱”，一般游客对此很不屑，既然是说国门，每个国人都不应该收费。我是熬到70岁后才免费进入的，为了表示种信念在里边买了80元人民币的俄罗斯雪糕带出来，该花的没有问题，就是不喜欢这种强行收费，国门还收费，该算国门吗？
v*0,2018-08-14,5,好评，干净，游客人数限制的还好。
z*0,2018-08-12,5,门口堵车20分钟进不去 唯一的缺点
快*乐,2018-06-24,4,慕名而来！感觉商业气息浓厚！还不错吧！
_*3,2018-07-12,3,我只想说，我对这个地方很失望。第一，作为国家边境口岸的象征，真的不该收费；第二，怎能允许小商小贩在“国门”吆喝贩卖劣质产品呢？第三，景区内规划很有问题，要改进的地方很多。
3*2,2018-07-10,3,到了满洲里国门是必去地，看到有官兵把手的国门，感动非常圣神与自豪，按理不应收费，国门的门票太贵，而且里面与神圣不符的推销购物，实在大跌眼镜。
s*o,2017-09-05,0,满洲里国门，位于满市西部中俄边境处我方一侧的乳白色建筑。国门庄严肃穆，在国门乳白色的门体上方嵌着“中华人民共和国”七个鲜红大字，上面悬挂的国徽闪着的金光。穿过桥下走到国门旁边，有微缩的前几代国门。
B*e,2018-06-15,5,酒店入住方便地理位置好酒店干净整洁外观好看距离各大景点比较近服务态度好送景区门票极力推荐
e*p,2017-07-19,0,满洲里是一座拥有百年历史的口岸城市，素有“东亚之窗”的美誉。满洲里国门，位于满市西部中俄边境处中方一侧的乳白色建筑。国门庄严肃穆，在国门乳白色的门体上方嵌着“中华人民共和国”七个鲜红大字，上面悬挂的国徽闪着的金光，国际铁路在下面通过。
e*6,2018-08-02,5,还可以，就是感觉门前较贵，没啥看的
挥*风,2018-09-13,4,满洲里旅行必须打卡的地方！看到庄严肃穆的国门
M*1,2018-06-27,3,感觉国门届碑这样的地方不应该收费，就算要收，感觉收高了，里面到处都是卖俄罗斯特产的，国门好威武，到这么远的地方来蛮辛苦的
J*4,2018-09-12,4,感觉不值这个价，40块钱还可以。
m*n,2017-10-05,5,可能是天气冷了，人不多，而且景区很干净。就是停不太规范都停在门囗，景区有电瓶车，但完全不用坐，景区不太大。可以在影区邮局发一张明信片。
乌*棒,2018-09-09,5,不用排队买票，还可以，就是景区没啥意思
M*8,2018-09-08,5,北方第一门，相当震撼，看到国门上中华人民共和国几个大字，自豪感油然而生。
M*8,2018-07-21,5,我国威武，到了国门一定要去，不是为了看景，是看我们的发展壮大
詹*增,2018-09-06,5,出票速度飞快，很不错的一次体验
l*n,2017-08-11,4,越来越贵的门票，真的没啥可看的了。
A*a,2018-09-13,3,没啥看的，就是个国门，还收钱！
1*6,2018-09-02,5,景点挺好的，能感受到祖国强大，虫子太多
2*5,2018-09-02,5,一般吧，来了要去看，不然就白来了
s*n,2018-09-11,3,一般般吧，其实真的没有啥意思。
M*2,2018-09-01,5,挺好的，就是蚊虫很多，有去国门的记得包的严实点
M*9,2018-09-01,5,景点非常漂亮！原生态的，值得一去！
h*a,2018-08-31,4,景区还好。满洲里市不错！特别是夜晚的景色很美！
M*6,2018-08-31,5,为守卫国门的武警战士们点赞！国门威武雄壮！
M*0,2018-08-31,4,总体还行，就是商贩在国门里叫卖，欠妥。关于国门展示的内容少，门票价格偏高。
M*0,2017-03-13,4,以前没有怎么听说过满洲里，去年夏天的时候计划带着家里去呼伦贝尔草原，才听说可以去满洲里看看，于是我想发现新大陆一样的和同行人说，后来才知道原来这是一个很有名的地方，原谅我的地理不好，出行前我们研究了很多种出行方式，可以坐飞机，从北京可以直飞过去，机场到达满洲里大概需要10公里左右，也可以火车，火车可以直接到达满洲里，前者的有点就是在于速度很快，基本上不会耽误很多时间，但是旺季的价格比较高，后者相对于便宜一些，不过火车的时间会比较长，在火车上或有些不自由，我们综合考虑了下，因为我们有老人，还有宠物想一起带着，加上我们感觉司机比较充足，所以我们选择的出行方式是自驾，我们同行2辆车，费用会比飞机低一些，我们同行的人时间都相对宽裕，计划的时间大概是13天左右，人均2000元，从北京出去，我们边玩边停下来休息，用了两天左右的时间，当然这两天不是一直都在赶路，也在沿途比较不错的地方游玩，回来的时间也大概2天左右，所以整体的路程都不是很赶还是很轻松的，我们去之前没有提前订好酒店，因为不知道时间安排，我们在景区周边找了酒店，大概一间房在300元左右，条件还不错，满洲里的人们还是很热情的，当地的小吃特色也是不错的，人均消费在50元，是一个不错的景区，值得推荐。
M*程,2018-08-30,5,无需排队，直接领票，票价便宜！
t*y,2018-07-11,5,挺坑的，应该公益开放，商人逐利。
安*3,2018-08-27,5,环境优美，空气优，气候宜人，建筑特色，特别是那里的晚上景色宜人。靓化工程美丽。
M*9,2018-08-26,5,还可以，一次很好的学习体验经历
_*6,2018-08-25,5,套票很值，套娃景区可以玩非常多的娱乐项目。
D*0,2018-08-25,4,还行吧……这种事情就应该这样对待
3*8,2018-08-25,5,非常好非常好非常好非常好非常好非常好
1*1,2018-09-02,3,政治意义大于游览意义吧，景区里小虫太多了，游览一圈太受罪
2*3,2018-07-20,3,一般吧，就是看看中俄分界的国门，相对来说，门票价格偏贵了
_*_,2018-08-23,5,够壮观，不错的地方，，而且网上购票方便，，不用排队。
m*9,2018-08-23,5,好，值得一去，祖国的北大门，很好
M*2,2018-08-23,4,这次主要是带孩子出来玩，他们说还不错。
M*4,2018-08-23,5,国门风景区让你看到不一样的异国风情。
2*9,2018-07-05,5,景区还好，网上购票挺方便，免税店和超市还划算
s*0,2018-08-03,1,真心不值这个价格，那么贵小火车还又单收费
M*0,2018-08-22,5,值得一去。体验一下国门，感受边境景色。
s*y,2018-08-22,5,爱国主义教育不错的选择地！推荐！
M*6,2018-08-22,4,这种国门地方竟然被私人承句收门票？
M*6,2018-08-22,4,私人承包门票太贵，国门象征国家主权不应收门票
M*0,2018-08-22,5,看到国门的瞬间还是觉得挺神圣的，但是觉得80一张门票还是有点高，肯能旅游旺季的原因吧
楚*嘶,2018-07-18,3,很一般，其实就是一个大门，可以看到对面的俄罗斯的门，没有什么特别的，收费价格偏高。
晨*7,2018-08-21,4,商业气息浓厚的不行不行的了。国门都承包出去了，不好。
M*3,2018-06-04,3,闻名而去，就一个栏起来的界碑。有两个展厅工作人员态度差被反复要求出示门票。展示内容空。80元的门票实在不值。
M*8,2018-08-20,5,景区不大，就是那天下雨了不太方便
5*2,2018-08-20,5,国门很有纪念意义，套娃广场更适合10岁以上孩子
1*9,2018-08-20,5,非常方便，直接入园，习惯性好评！
2*0,2018-08-18,4,取票很方便，景色么，有政治意义的，祝愿祖国繁荣昌盛，要是不要钱，更好了。。。
新*天,2018-08-18,5,景点漂亮，大家可以去玩玩，，，，，，，
蓝*海,2018-08-18,5,非常喜欢站在边境的感觉，值得一看。
1*1,2018-08-16,5,很好的一次旅游体验，满洲里充满了异域风情
_*6,2018-08-16,4,出票很快，票价性价比可以，建议购买
m*4,2018-08-16,4,人好多，排队的时间太长，只是一个牌子的提示，容易多走冤枉路！
M*3,2018-08-16,5,感受到了国门的威武庄严，购票经济实惠，速度快
1*3,2018-08-15,5,迅速快捷，手机现订，旁边一体取票机立取了
1*5,2018-08-15,5,园区太大了。如果每个景点都去的话，两天都紧张。
s*虹,2018-08-15,4,人多服务差！窗口开好几个 需要分开办理免票、换取纸质票等！麻烦！
7*0,2018-08-15,5,这个景区很好，能够看到俄罗斯景色。
小*爹,2018-08-15,5,还不错，来了必须去的景点。网上很订票方便还能优惠点
w*7,2018-08-14,5,很好 很方便 不需要排队   
M*2,2018-08-13,5,犯我中华者，虽远必诛！！！！！！
E*3,2018-08-13,5,不错，挺好的，可以去看，方便的
_*6,2018-08-13,4,很好看，就是人多了点，瞭望台挤不上去
o*1,2017-01-30,0,第五代国门景区为国家5A级旅游景区，坐落于满洲里市区以西8公里处中俄两国铁路连接点中方一侧，建筑非常壮观，环境非常优美。与原苏联国门相对应，对比也是很明显哦。满洲里第五代国门是中国陆路口岸最大的国门，此处历经几代国门历史悠久，曾经是红色国际秘密交通线，目前是红色交通线教育基地。
_*8,2018-08-12,5,购票快，方便，国门庄严，，门票有点小贵
_*8,2018-08-12,5,购票方便，快捷，国门庄严，值得去。门票有点小贵
M*5,2018-08-12,5,还是值得一看的，就是觉得门票稍贵。
当*n,2018-08-12,5,很好  庄严肃穆  站岗的兵哥哥很辛苦
好*妹,2018-08-12,5,国门庄严肃穆，在界碑旁可以看到俄罗斯的国门。
M*5,2018-08-12,4,物有所值！挺有特色的！可以看看！
3*7,2018-08-21,3,感觉 价格高 没什么必要 陪父母去的 
1*6,2018-08-11,5,感觉还可以，来到了祖国和俄罗斯的边界
拿*发,2018-08-11,5,非常棒，拿二维码直接在自助机上取票，不用排队。网上买的国门景区私套娃景区的套票，优惠了18元。
M*8,2018-08-10,5,看了下国门 游玩感觉还可以 网络票还有两块优惠
e*2,2018-08-09,5,很方便，排队的人乌央乌央的。网上买票方便多了。贵.
M*1,2018-08-09,4,略有优惠，省了排队时间，景区商业氛围太重，有损国门庄严形象
y*空,2018-08-09,5,不错，有优惠 速度还快，便捷方便！
_*8,2018-08-09,4,到内蒙旅游就一个感觉，花花花，啥都是钱！
M*1,2018-08-08,5,买完电子票没有必要去取纸质版票，凭二维码直接进院。
M*3,2018-08-08,5,尽管没什么可看的，但是不去也遗憾，随波逐流的溜一圈吧！
M*1,2018-08-08,5,国门威武！带孩子去有很好的教育意义！
M*0,2018-08-08,5,晚上的节目很好，住在套娃酒店可以无限次出入
库*台,2018-08-07,5,取票快捷不过爱国主义教育基地收门票不应该
M*7,2018-08-07,5,好好好好好好好好好好挺好挺好挺好
1*0,2018-08-07,4,是一个值得去一次且仅去一次即可的地方。
g*o,2018-08-07,4,不是太值得看，门票太贵了。而且景区出口必须从商场走，太...
x*6,2018-08-06,5,取票很方便，景区能逛一个多小时
_*6,2018-08-15,3,总体感觉一般，没有想象中的好，人多
3*3,2018-08-03,4,门票价格有点高，不过值得一游，毕竟是个比较大的陆路口岸
_*5,2018-08-03,5,不错，还行吧，80元看你感觉，不去也行
1*7,2018-08-03,5,几年前来过，感觉变化很大，商业气息太浓了。国门的雄伟壮观，界碑的依然耸立，给人瞬间的震撼。
2*6,2018-08-03,5,感觉还可以吧，性价比不好。20元往返园区小火车不值得坐，距离太近了
1*2,2018-08-03,5,国门景色，振奋人心，值得去看看
M*4,2018-08-03,4,看看之前的国门，爱国教育的好地方
1*赫,2018-08-12,3,看你啥目的啥心绪啥觉悟了被，爱国主义教育必去
M*9,2018-08-12,3,不是很值得期待的地方，国门乃国人之屏障，要么严格管理，要么公开参观；以国门之名赚国人的钱，不妥
M*0,2018-08-02,5,很好很便捷，到任何一个点电子票还不用排队。
西*仙,2018-08-02,5,两个经典景点，不错。走马观花，也是值得一游。网上购票快捷方便，取票自助也便捷。
a*3,2018-06-14,5,该景点很好，让我学到了一些历史知识，也受到了一次爱国主义教育。
神*姗,2016-08-26,5,玩的很不错，价格也不贵，就是好多游玩项目因为游客少，下午都没咋开，等到晚上人渐渐多了，才不需要等待。套娃广场建议晚上去玩，晚饭在外面吃早点，广场的晚饭确实不怎么样。我们六点多去到，拍点照片，等到7点半到8点之间陆续开灯了，再拍夜景，确实很震撼。九点十分还有演出，因为儿子累了，晚饭没吃，很遗憾没等到。所以建议吃饱，到里面尽情玩哦！
西*仙,2018-08-01,5,购买顺畅，很方便。景区自动出票机也十分便利。
1*2,2018-08-01,5,还不错，刚开始都忘记可以在网上预订了
M*2,2018-07-31,5,陪同朋友参观国门，对国家的热爱更强烈，祝愿伟大的祖国更强大！更美好！
幻*9,2018-07-30,5,自驾来到了满洲里，第一时间去了国门。国门神圣庄严。非常值得一去。
幻*9,2018-07-30,5,这是第二次来到国门，第一次是去了二连浩特国门。满洲里很漂亮，尤其是夜景非常好看。
M*7,2018-07-30,4,还可以，看了两国的国门，还看了界碑，当时有人在国门上晕倒，停止了一段时间的开放，处理的比较及时
m*9,2018-07-30,5,处在国门边上，历史内容丰富，爱国主义教育的佳地
M*2,2018-07-30,5,教育意义重大，很好。可以时间避开高峰期，不然要排队。天热，要注意防晒
南*帝,2018-08-08,3,旺季人多，到处排队。不过国门还是很庄严的
m*4,2018-08-08,3,没意思，只是觉着毕竟来了，得看一眼，说实话确实不知道，就当是为祖国边防捐钱了。
2*1,2018-07-29,5,很雄伟，草原美丽。不过这个景点收门票不大合适，其实主要还是让老百姓爱国主义教育比较有意义。
s*u,2018-07-28,4,值得一看，但是门票略贵了，也算是爱国主义教育基地，因该便宜点
M*6,2018-07-28,5,商业化太浓。。。。。。。。。。。。。
M*1,2018-08-06,3,景区商业化了，几年前不要门票，就是个国门，一般！
M*3,2018-08-06,3,进去排半天队爬上去，看了看对面，浪费时间，票价很不值
不*鼠,2018-08-05,3,就那样，没什么看的，就是个国门而已。一般，民族感情支撑。
不*鼠,2018-08-05,3,就那样，没什么看的，就是个国门而已。一般，民族感情支撑。
不*鼠,2018-08-05,3,就那样，没什么看的，就是个国门而已。一般，民族感情支撑。
M*5,2018-07-26,5,值得一看，到满洲里必去的景点。
M*3,2018-07-25,5,国门威武，风景优美。天气凉爽，印象深刻。
M*2,2018-07-25,5,这个不用评价吧，网上购票方便。
神*纸,2018-07-24,5,很有意义的一次旅程，五代国门各有特色
c*k,2018-07-24,4,景色一般，就是这个点意义非凡。
明*7,2018-07-23,5,喜欢那里的照片，还有红色展览馆。
1*1,2017-05-11,5,中俄边境-蓝天白云，交通便利，价格适中，性价比高
D*5,2018-07-22,5,比较有意义的景点，但是正如导游说的，不进去后悔，进去更后悔！
忙*人,2018-07-22,5,门票比景区门口便宜了，满意的一次行程
E*0,2018-07-21,5,名副其实的国门，不错哦，电子票更是方便简单。
_*8,2018-07-21,4,神圣的地方，厚重的历史意义，商业味太浓了
M*1,2018-07-21,5,很好的游乐场，俄罗斯马戏必须看。
西*冽,2018-08-09,1,很有意义的景点，垃圾的服务。小火车送出门，半路扔下，态度粗暴。
2*8,2018-07-20,5,近距离接触，展室不错，很多领导人来过。
D*0,2018-07-18,4,应该去看看 真的很开心 干净卫生 点赞
M*1,2018-07-17,4,位于满市西部中俄边境处我方一侧的乳白色建筑。国门总长105米
M*4,2018-07-17,5,方便实惠，希望多搞些活动。优惠消费者！
_*1,2018-07-26,3,门票也太贵了吧，停车入口不标明，只标明是购物免税店入口，没啥可看的
M*7,2018-07-15,5,取票方便，回顾了解历史，值得一去
