author,date,score,comment
千*骑,2019-07-13,5,总体不错，但是工作人员对41号界碑旁边的40号红白相间的界碑不了解，有点遗憾！
1*0,2019-07-12,5,国门是值得去一趟的，有历史感，也可以购物
M*0,2019-07-12,5,为啥非得写评论，直接提交不行么？
2*7,2019-07-12,5,网上68，直接买70，省两块是两块，主要是也很方便，在旁边自助机很快出来。
云*6,2019-07-11,5,非常方便，里面景色不错，瞭望俄罗斯
m*i,2018-08-04,4,国门景区还算可以，也值得一看，里面适合拍个照。景区出口之后，有个卖吃的的地方忘了叫什么了，大列巴19.8元，提拉米苏19.8元，比较贵了，在往外一些，10元就可以买到了。旁边的所谓免税购物很没劲，每人十元办卡进去，里面就是一些吃的喝的，巧克力等一些特产，一家一家的，感觉都是私人的，招商招进来的，还不如市里步行街上买。
h*r,2018-03-10,5,国门经几度重建，落定成现在的样式。两端强壮的门柱塔架起中间厚厚的横框通道，庄严的国徽悬挂中央。从门柱可乘观光电梯到横框通道，通道实际是一个展示大厅，介绍国门的建设过程和经历。透过大厅的窗口，游客可眺望中俄边境两面的景色。国门之下，火车穿越两国边境。俄罗斯也有国门，但规模和设计远不如我们。国门充分反映了一个国家的经济实力。国门旁边的有从建国到现在，各个时期的国门模型展示。
z*9,2018-04-22,5,站在中俄边界的交汇处，国门的国徽庄严而神圣，五星红旗迎风飘扬，而对面的俄罗斯国门太逊色，作为中国公民的我一种民族自豪感不禁油然而升[微笑]感叹之余，一辆通往俄罗斯的火车缓缓驶来，展现了中俄两国的友好往来，祖国万岁[强]
M*9,2019-07-04,4,登上国门大厦，远眺俄罗斯;游览六大会址，回顾峥嵘岁月——国门景色令人难忘
1*0,2019-07-04,5,看国门变迁，感受到作为中国人的自豪，是爱国主义教育的好地方。
迷*铁,2019-07-04,5,变化真的太大了，和1993年比
麟*儿,2019-07-03,5,带着家人，老人孩子自驾游，非常好，我爱你大中国
幽*隅,2019-07-01,5,来到满洲里，你一定要去国门看一看，那是红色教育基地，了解一下历史
伊*喵,2019-07-01,5,国门景区，必要去打卡，但是套娃景区，如果随行没有小孩的的话，有点儿鸡肋！
1*0,2019-07-01,5,非常不错国门，远远看到俄罗斯，对比还是有的，还有几代国门的微缩景观，也可了解历史~
b*o,2018-10-06,5,挺好的 进去转转 感受下祖国的伟大！
三*多,2019-06-30,4,挺好，人不是太多，有人现场讲解最好！
M*6,2018-07-24,5,满洲里第五代国门是我国陆路口岸中最大的国门。景区包括41号界碑、红色国际秘密交通线遗址、红色旅游展厅、和平之门、火车头、战斗机等，是5A级景区，出口在互贸区，可以购买免税商品
y*o,2018-07-24,5,国门口一游，不仅是有国门和界碑，而且也了解了满洲里的历史和满洲里的红色记忆！
3*6,2019-06-29,5,人很多，有交通车可坐到国门下，有界碑，附近还有六大的纪念馆，值得一看。
扭*代,2019-06-28,5,自己带娃来国门，吐槽一下，电瓶车不是一般人能坐得起的，门票也真是贵
呼*木,2019-04-08,3,其实这个不应该叫做景区，里面真没啥景色，应该叫做爱国主义教育基地。里面除了界碑没有其他可看的。面对80元的门票，平分给三星已经算是很给面子了。
L*G,2018-04-22,0,站在中俄边界的交汇处，国门的国徽庄严而神圣，五星红旗迎风飘扬，而对面的俄罗斯国门太逊色，作为中国公民的我一种民族自豪感不禁油然而升[微笑]感叹之余，一辆通往俄罗斯的火车缓缓驶来，展现了中俄两国的友好往来，祖国万岁[强]
g*y,2018-05-30,4,见识了什么是国门，国门乳白色的门体上方嵌着“中华人民共和国”七个鲜红大字，上面悬挂的国徽闪着的金光，国际铁路在下面通过。景区内有41号界碑等.....值得一提的就是景区里的饮料等价格贼贵贼贵，特别是冷饮。
急*想,2018-06-29,3,到了满洲里肯定还是要去看看，不过也就是中国人，弄个地方就弄成景点赚钱，对面的俄罗斯国门很简单，总国门的顶层可以看到俄罗斯和满洲，真的感觉满洲里的建筑风格更像俄罗斯，俄罗斯却没有那些俄式建筑。
蓝*味,2018-08-07,3,国门还可以，套娃广场有些坑人，买了148元的门票包含里面游乐项目的费用，但是有些项目不是没开，就是限制开放时间，尤其是球幕飞翔影院，几百人在外面排队，有人从12点等到下午3点多依然没排上，因为一场只能进40人，一个小时只放一场，其实一场才10分钟而已。根本没有排进去的希望。景区制度真的需要整改！
z*5,2018-08-11,4,还行吧，就是上国门爬楼太费力。望远镜十块三分钟还不能换人。
y*0,2018-08-06,5,非常美！气候宜人！空气清爽！值得一看！
蒙*中,2018-08-01,3,把国门做成景区，还说是爱国主义教育基地，原本崇高的爱国热情被标价出售，真是醉了。从大门到国门有小火车往返，每人20元，但景区不大，没必要坐。出口很长全是商铺，全都买俄罗斯小商品，直通免税区，感觉整个景区就是个大号的高速公路服务区，档次太低。只有出国不容易的人才对国门感兴趣吧。
a*9,2019-05-24,4,一家老牌子的景点，还是不错的样子
星*儿,2018-08-29,5,国门必需去，环境优美，历史悠久
_*3,2019-05-20,5,挺好的，值得一去，有教育意义，不可多得的好去处
1*8,2018-03-10,0,国门经几度重建，落定成现在的样式。两端强壮的门柱塔架起中间厚厚的横框通道，庄严的国徽悬挂中央。从门柱可乘观光电梯到横框通道，通道实际是一个展示大厅，介绍国门的建设过程和经历。透过大厅的窗口，游客可眺望中俄边境两面的景色。国门之下，火车穿越两国边境。俄罗斯也有国门，但规模和设计远不如我们。国门充分反映了一个国家的经济实力。国门旁边的有从建国到现在，各个时期的国门模型展示。
蔷*5,2018-07-17,3,如果不是带孩子去，真的别去玩，啥也没有里面，除了几个游乐设备，比如碰碰车等，一张通票只能做一次，不买通票要补钱坐这些，个人觉得没啥意思，里面的小木屋都不开放，就四五个游戏机而已。实属浪费时间了，大马戏个人觉得没啥意思，没有新意，太一般了，不建议去内游玩，大马戏更没劲，240门票还不如在外面看看外景，照点相片，外面的旅游商店卖的奶豆，说好的蓝莓馅料的，买回来一尝是像咖啡色焦糖一样的馅料，上当了。不建议购买。
_*8,2017-10-02,5,五代国门见证了中国的发展。从第一代国门的两根木棍，到第二代国门的中苏门，再到第三代国门的世界无产者联合起来，再到第四代国门的中华人民共和国，最后第五代如此壮观的大国门。我们有幸看到了俄罗斯从两道国门运往中国的木材，看到了中俄两国合作发展的桥梁。
t*y,2019-05-08,4,慕名而去，中国这边的建筑景色更象俄罗斯。
r*9,2018-05-30,0,见识了什么是国门，国门乳白色的门体上方嵌着“中华人民共和国”七个鲜红大字，上面悬挂的国徽闪着的金光，国际铁路在下面通过。景区内有41号界碑等.....值得一提的就是景区里的饮料等价格贼贵贼贵，特别是冷饮。
_*9,2018-09-04,5,满洲里旅行必须打卡的地方！看到庄严肃穆的国门，确实心情满激动的，
3*5,2019-05-13,3,门票太贵，不值得。对面是俄罗斯小镇。
辣*面,2018-08-26,5,几年前自驾一路从沈阳去呼伦贝尔大草原，然后去满洲里，游览了国门景区，正赶上小长假，人超级多，拍照站排啊！！！国门看着巍峨，令人肃然起敬，记得界碑是41号界碑。值得一去！！！
e*3,2019-04-25,5,总体感觉可以，人也很多，还是不错的！
刘*阳,2019-04-24,5,有情怀的可以去看看，一般就是长辈们想看看。
二*哥,2018-10-11,5,国门是必须去的景点，爱国主义教育好去处。现在是第五代国门了。真正见证国家边防口岸变化的地方。
开*活,2019-04-22,5,在这上面购票让人出行很方便的。
1*0,2019-04-22,5,国门很漂亮，9月份这个季节来比较舒服。
6*6,2019-04-20,5,震撼 国门 感到自豪 景色不错
顾*孩,2019-04-18,5,去看看国门的历史，挺好的，感受一下气氛
M*3,2018-08-17,5,国门还是比较震撼的，但商业化气息浓厚，处处皆有售卖物品。参观国门馆内的楼梯较高，老人孩子有些吃力。站在国门前自豪感油然而生，老骄傲了！
蓝*味,2018-08-07,2,套娃广场的游乐项目真的让人无奈到吐槽，制度太不合理，148的门票收了游乐项目的费用，有些项目根本玩不上，不开放，限制时间限制人数，比如球幕影院，想排它的队伍，基本就不能玩别的了。园区内已经有很多游客不满了
一*鼎,2019-04-17,5,去看看，威严大气，一门之隔的俄罗斯，
d*4,2018-06-24,3,满怀崇敬之心来到国门，却发现这里俨然是一个商业化极其浓重的景点，不想被景区消费我们的爱国之心，只在大门外拍了两张照片，在这里的免税区商品集散地买了些商品，然后延着边防公路开去……  真心觉得身为中华人民共和国公民不应该收80的门票费！
x*t,2018-08-14,5,国门威严，景色优美，士兵守卫着祖国的大好河山威武！！！
M*1,2017-09-05,4,国门景区票价80元，另外可购买小火车票进入景区。界碑处挤满了人。相比俄罗斯那边空旷寂寞的草原，这里是太热闹了。望着这雄伟的国门和界碑上鲜艳的国徽，敬畏之情油然而生。回来时，在免税店买些俄罗斯特产，很不错。
M*5,2017-10-22,5,沿着中俄边境线行走的一天。出满洲里国门便是俄罗斯远东地区，西伯利亚大铁路穿过海参崴贝加尔湖后可至莫斯科，如果愿意火车旅行这种古老而缓慢的交通方式可带乘客至欧洲诸国。历史意义大于景观本身的地点，来的原因是历史课本上那些久远的地点和波澜壮阔的事件。在这个世界是平的时代，边境线上无处不在的铁丝网和界碑给人一种新启示。
b*3,2018-11-15,5,感受祖国的强大 很不错的地方推荐
_*1,2018-09-12,3,我们到的时候回来正好有辆从俄罗斯开回来的火车，就在国门上照了几张照片。走路进去回去要走另一条路出去，各种卖纪念品的商店超市，外面的花开的不错
M*7,2018-08-07,5,还好，挺漂亮的，就是景色太少，门票太贵
I*T,2018-08-06,5,很小的时候来过，那时候交通还没有现在便利，也没现在容易。祖国边境，值得参观留念，国门很壮观，每一个中国人来到这里都应该来参观一下。
t*o,2018-08-04,5,国门庄严神圣，不过去到哪里，只要是边界城市，都喜欢去看看国门，不过满洲里国门比较特别，买票就可以进去，一般国门是无法进去的
M*5,2019-04-02,5,值得信赖的网站，值得看看的景点，有意义的旅行
S*6,2018-09-19,5,国门值得一看，庄严神圣，应该看看。
千*行,2018-08-01,4,满洲里国门景区位于内蒙古的满洲里市和俄罗斯边境。进入景区是收费的，而且必须出示证件，非中国公民可能进不了。景区大门外有个中俄商品贸易区。
寒*月,2018-07-28,5,有点一方向环境也是不错的，弱人就是不少，但是各种的卖东西的是最多的，什么样的都有，是免税区的实际上还没进市区呢，而且国门景区是单独要门票的，虽然不贵吧，电影
小*刀,2018-07-26,4,朋友回黑龙江老家顺便游览满洲里，还是祖国的边疆漂亮啊，天气凉爽，蓝天白云，外国妹妹也很漂亮，夏天避暑的好地方，四星推荐。
鋆*n,2018-07-25,4,既是中俄国界，又是曾经的红色交通线所在，很有历史意义的地方。国门下至今还通火车。站上观景层，俄罗斯就在眼前。就是感觉80元的门票有些贵了。
3*9,2018-07-24,4,景区比想象中大，国门每层都有卖纪念品的。小火车出去不送到停车场，送到了保税区购物点。里面的视频贵些，但品质应该有保证吧。
M*2,2019-03-21,5,满洲里口岸走向新中国的一条道路。
害*子,2019-03-18,5,很好，去的时候是淡季，人很少。
M*8,2017-08-09,5,先说路线，进门——满洲里红色革命纪念馆——界碑——国门二楼——六大纪念馆——出门。整个景区确实让人看到了三十年河东四十年河西的沧桑变化。当初中东路事变，六大，抗战，苏援的时候，有谁想的到，那个积贫积弱国度的子民，能一个个光鲜亮丽的，悠闲自在的对曾经北方的劲敌，曾经的老大哥，指手画脚品头论足呢？
N*i,2018-09-02,5,国门太坑了～不值得来，票价太高。出门需谨慎
1*7,2017-06-17,5,这个国门跟难进，要留下80元的“买路钱”，一般游客对此很不屑，既然是说国门，每个国人都不应该收费。我是熬到70岁后才免费进入的，为了表示种信念在里边买了80元人民币的俄罗斯雪糕带出来，该花的没有问题，就是不喜欢这种强行收费，国门还收费，该算国门吗？
M*2,2018-12-03,5,满洲里国门景点值得去，篮云白云下鲜红的中华人民共和国几个大字特别显目，登上国门向远方俄罗斯眺望，沃野千里的感觉。
_*1,2018-08-26,5,威武高大的国门，喜欢喜欢。推荐大家来。
L*3,2018-08-26,4,中俄边境的国门，庄严肃穆，41号界碑，再往西50公里就是中俄蒙三国的交界处…参观时正好有中国车出镜，由于已经检查完毕，在国门处直接通过的，已经换轨完毕（出镜前换成适应更宽轨道的轮子）。买了一根俄罗斯进口的雪糕，25元，感觉不如马迭尔…据说
2*2,2018-08-23,4,      8月初的，非节假日的周一去的，竟然都有这么多人，停车场完全停不进去，只好停在路边。     国门实际就是个门字形建筑物，比对面的俄罗斯国门大好几倍。景区里有一个满洲里历史展，以及与满洲里相关的党史展，还是挺值的一看的。在其它地方，可能很难看到这么详细的史料。
申*少,2018-08-22,5,雄伟的国门 壮我国威 我爱你中国
Y*6,2018-07-03,5,还可以，好好好好好好好好好好好好好好好
M*2,2019-03-01,5,非常棒，有机会一定会再去的！！！
M*7,2018-08-18,4,比起对面的俄罗斯国门，我国国门显得高大雄伟，这里已经发展成为一个非常成熟的景区，有免税购物区，据说里面商户很少，没有进去逛~旁边出口经过的地方有一个俄罗斯超市，里面东西很便宜，都是俄罗斯进口的~值得逛一逛~
大*水,2018-08-17,5,雄伟壮观，感受到国家日益强大。
_*1,2018-06-28,5,我去的时候闭园了，不过也就是一个国门。在其他地方国门看多了，就没什么感觉了，不过这个国门门票有点贵！个人感觉不是很值门票要80元。国门跟套娃广场挨的很近，带了小孩子可以去玩一下，女孩子应该比较喜欢，拍照好看。
M*6,2018-08-14,4,庄重严肃 体现大国风范 祖国北国第一门
M*7,2019-02-24,5,快速领票，不用排队非常好 很好
开*柿,2018-08-13,5,国门景区离满洲里市区很近，可以坐六路或十路公交车到达，进入景区，可以看到中俄两国的国门，同时可以了解满洲里五代国门的历史，夏季是满洲里旅游的高峰期
M*4,2018-08-13,4,和小孩子一起去的，大人买了联票210元。小孩子国门半价是40元，套娃景区小孩子没有半价，就是118元，哪怕1.22米也是118元，所以门票价格是贵了。不过进景区后，特别是套娃景区，哥特式的建筑，真的非常美，小孩子感觉是到了童话里的城堡了，拍的照片也很美。穿越千山万水，2500公里来这里，套娃景区还是可以的，只是旅行社给我们只有1小时，若是慢慢逛更好。
-*u,2018-08-11,5,可以在机器取票，非常方便。国门碑界庄严神圣！骄傲自豪！
j*6,2018-06-23,4,退休后才有时间到处旅游，不赶时间不用请假，真正的享受生活。趁着腿脚利索，我这老哥几乎没有闲在家里超过两个月，这也是我的理想吧。
3*3,2018-08-10,5,看到值勤的军人站在烈日下，那一刻很感动，很想为他撑起一把伞，我们的幸福生活安全来自于他们的辛苦付出！
M*0,2018-08-05,4,门票贵，建议网上买票在景区入口直接扫码进入。上午9点左右售票大厅拥挤不堪，服务中心2人面对有疑问的游客多，难以快速一一解答。旁边卖纪念品柜台的服务员似乎不愿解答游客的问题，猜测是因为你不买东西的缘故。总体感觉不是所有的景区工作人员都有服务意识。
v*6,2018-10-02,2,庄严肃穆的国门商业化气息如此严重令人失望，明明有直达电梯不让坐说维护让走楼梯，其实是每层楼都有商店等着你吆喝，出口也是必经商场。在外面看看就好了，70元不值得。
读*国,2019-02-24,3,一般般吧，一个国门，进去没啥可看的
h*z,2019-02-14,5,就是感受一下边境的感觉，国门很大，需要步行爬上去
糖*糖,2018-08-03,5,出票快！到达景区后购买了4张联票，初试一张身份证即可！马上使用，并且有绿色通道，进园速度快！特别方便！还有折扣！
1*8,2018-08-02,5,在这个地方，一边是中国，一边是俄罗斯，景色非常美。
M*0,2018-07-29,5,必须去一定去的地方，彰显国威军威的地方
带*下,2019-02-06,4,取票方便，票价奇贵，国门卖钱，实实不该！
l*a,2018-07-23,5,金碧辉煌 非常适合一家大小 小孩子的天堂
非*士,2018-07-20,5,看到了神圣的国门。很开心 为我们的祖国自豪。看到了站岗的兵哥哥 辛苦啦
M*5,2019-01-26,4,还行吧！！！！！！！！！！！！！！
_*4,2017-06-21,5,这里是满洲里比较有名的国门景区，必须带好身份证件才能进去，除了景区门口会看，到了里面还有士兵要看，把关挺严的。现在的国门是第五代，高大上，能上去看两边的风景，很明显中国的房子比俄罗斯的好很多。去了几个边境，发觉还是中国人聪明，把边境旅游发展的红红火火。
M*9,2018-08-13,3,最大亮点就是边境，界碑和往来中俄间长长的货运列车。但是是5A景区，倒是感受不深，毕竟区域不大，又不是自然景观。但是的确值得一去。
黑*葯,2018-07-12,4,祖国边境神圣不可侵犯，到了这里就有一种莫名的庄严感，很值得游览观光一番，至于里面卖的东西，劝大家还是最好别买，尤其是国门大楼里面的商户，买的东西比外面贵一倍，很黑很坑人，个人觉得这么庄严的地方商业化却很浓，有点粉末倒置，就算设有商户，为了促进地方经济也无可厚非，但要更要严格管理，这里毕竟是祖国的门面！！！
M*1,2018-05-24,5,满洲里值得去，特别有俄罗斯的风情。
徐*敏,2018-10-16,5,庄严神圣的地方，必须要带孩子来看一看
1*6,2019-01-21,4,景区环境和管理都不错，值得一看。
M*5,2018-07-08,5,满洲里是边境城市，个人觉得到了满洲里，国门是要去看一看的，风景一般，但是比较有仪式感，运气好的话，会看见俄罗斯来往运送货物的火车。
_*4,2019-01-14,5,买票很方便，出票很快，以后还会再来买
s*u,2019-01-12,4,门票价格建议下调，毕竟是爱国主义教育基地
大*水,2018-08-17,5,值得一去，非常好。离套娃景区非常近
h*n,2019-01-09,5,家人都说好，很开心在这里度过美好的一天
快*对,2018-06-27,5,满洲里标志性的风景区，国门看着比较庄严，有大国的起势。
冒*琳,2019-01-07,5,很不错了很不错了哈哈哈哈哈哈哈哈
1*9,2018-06-26,5,终于来到满洲里，这里与俄罗斯接壤，住酒店进出就碰到很多金发女郎。满洲里国门，位于满市西部中俄边境处我方一侧的乳白色建筑。国门庄严肃穆，在国门乳白色的门体上方嵌着中华人民共和国七个鲜红大字，上面悬挂的国徽闪着的金光，爱国情怀油然而生。
b*9,2018-05-07,5,挺不错的地方，站在国门上看俄罗斯，挺自豪的，唯一不足的地方就是厕所太少，一个景区只有俩厕所，还有一个厕所只开放女厕
欣*雨,2018-08-12,4,第一次到满洲里，国门还是值得一看的，就是票价比较贵。小火车的话，如果不是带着孩子坐着玩，可以不做的，里面一共也没多远。
2*0,2017-09-05,5,满洲里国门，位于满市西部中俄边境处我方一侧的乳白色建筑。国门庄严肃穆，在国门乳白色的门体上方嵌着“中华人民共和国”七个鲜红大字，上面悬挂的国徽闪着的金光。穿过桥下走到国门旁边，有微缩的前几代国门。
M*9,2018-08-08,5,国门 大家都很向往 其实就是个门 进去也就是拍照 人特多 大概游2小时足够了 车一定要停在停车场 不如会被贴条
M*4,2018-09-01,3,可以不去，41号界碑看不见，没有什么可以看的
米*3,2018-07-17,3,国门收费偏高，这个价位的不值，主要是去看界碑，和对面的俄罗斯小镇，整体性价比不高，要从门岗走500米进入国门大楼，电瓶车是包车的形式，每车100元。不是每个人买票制，这样包车就给人多的团队创造便利，而散客就不能乘坐，除非包车。如果改成每人门票制，这样更好，可以服务更多散客，电梯不开，不管年老年幼全部走一米宽的楼梯上下行，缺少人性化管理。建议开放电梯，服务更多老弱病残。五楼观景台，不提供免费望远镜，要单独付费10元，才能看，使用望远镜，个人觉得78门票应该包含望远镜服务。2-5楼，楼梯边侧都是私人俄货商店，商业气氛浓重。
1*0,2018-08-24,3,门票太贵，十分不值，国门很棒不知道为啥要收费，套娃广场就是一个游乐场，玩具不多还有很多不开
5*游,2018-07-30,5,隔着分界线近在咫尺地望见一直觉得是远在天边的邻国，太神奇了，站在国门界碑前很有神圣感
_*9,2017-03-30,5,满洲里国门，位于满市西部中俄边境处我方一侧的乳白色建筑。“中华人民共和国”七个鲜红大字高悬在建筑上，国徽闪着金光，国际铁路在下面通过。景区包括：41号界碑、国门、红色国际秘密交通线遗址、和平之门主体雕塑和满洲里历史浮雕、红色旅游展厅、火车头广场等景点。经过百年风雨洗礼和十年开放磨砺，满洲里已经成为一个蜚声中外的口岸名城。上个世纪的二、三十年代，满洲里是我党与共产国际的红色通道；四十年代，苏联红军从这里打响了欧洲战场支援太平洋战场的第一枪；解放战争和抗美援朝战争时期，满洲里口岸曾把大批苏联军援物资运往前线；建国初期，面对帝国主义的海上封锁，满洲里作为共和国的主要外贸通道，有力地支持了中国的经济建设。1992年满洲里被国务院批准为首批“沿边开放城市”后，满洲里经济和社会各项事业实现了历史性跨越。满洲里正以崭新的形象屹立于祖国北疆。
r*7,2018-05-24,0,满洲里值得去，特别有俄罗斯的风情。
幽*幽,2018-12-29,3,没有啥可看的，俄罗斯那边也看不到什么
1*3,2018-08-19,3,是个园区，可惜啊，进不去，只能远眺，，
M*0,2018-07-25,5,站在国门，有种强烈的自豪感，非常好。
M*作,2018-06-06,5,一路上可见多幢异国风格的建筑分别是海关和边防，很有特色。到达中俄边境中方一侧乳白色的国门后，先排队乘坐电梯到国门观光层，俄境内的车站、建筑、街道、行人尽收眼底，而中方一侧的41号界碑广场、火车头广场等景点，以及专门从事边贸的商业设施也一览无余。
D*0,2017-10-05,5,自我感觉国门的价格有点高，还有像这种具有教育意义的景点最好配上免费人工或电子讲解，尤其是那两个展览馆。从国门景区出来去了套娃广场，没进景点照了几张相就坐公交会住处了
_*5,2018-07-17,5,满州里国门景区—-壮严神圣的中国人民共和国“国门”及界碑值得一游。
M*7,2018-07-17,5,感受国门的威严，了解满洲里的历史，还可看到中国界碑！
小*9,2018-08-10,4,下午去的人不是特别多，但是除了国门真的没什么可逛的，票价略贵，免税店没什么东西。
海*3,2018-09-01,5,自信，感慨、就是虫子太多，建议全副武装、戴上墨镜
m*4,2017-08-07,4,中俄两国边境分界点，有四代国门的历史介绍，看看以前的国门好简陋，对面就能看到俄罗斯，国门景区人也算比较多的，附上两张打卡照～
